name,author,number,mark,publish_time,extract
二十四史：完本精校大全集（中华古籍国学宝典文库）,尹小林校注,174人点评,89.90%,2022年7月,本书由国学网创办者、首都师范大学电子文献研究所所长尹小林携汤一介、冯其庸、庞朴、陈来、白化文、李零、孙家洲、王立群、佐藤利行、方铭、邓小军等百位专家学者、教授历经二十余年编纂、点校、排版制作而成，涵盖（史记、汉书、后汉书、三国志、晋书、宋书、南齐书、梁书、陈书、魏书、北齐书、周书、南史、北史、隋书、旧唐书、新唐书、旧五代史、新五代史、宋史、辽史、金史、元史、明史）的合辑，记载了从黄帝到清末四千多年的史事、人物、经济、文化、政治、军事、教育、典章制度、天文、地理、灾异等等，是中华文化的重要组成部分，具有极高的文学价值和史料价值。在本套《二十四史》中，《史记》和《汉书》以民国百衲本为底本，其余史书则全部以武英殿本的《二十四史》为底本，各本在勘校过程中，都参考了其有关的善本，订正了武英殿本中的讹误，但其他部分尽可能保持了史籍的原汁原味，包括人名、地名中的异体字等都一般不改，古体字和通假字也一般不作修改，为读者再现史籍原貌。
改革开放口述史,欧阳淞 高永中,24人点评,79.20%,2014年1月,本书选择三十多年改革开放历程中的重大决策和重大事件，系统梳理、精心选编，以口述史的形式，让亲身经历和见证改革开放历史的老领导、老同志追忆细节，让见证者感悟得失，让思想者升华经验，目的是真实、生动、具体地再现历史，为改革开放史研究提供第一手资料，也为广大党员、干部、群众提供生动鲜活的新时期党史读本。本书由中央党史研究室主任欧阳淞作序，收录了万里、陈锦华、谷牧、龚育之、刘鸿儒、曾培炎、徐匡迪、龙新民等50余老领导、老同志的回忆录、口述历史，是研究这段历史的重要资料和宝贵财富。
改革开放口述史,欧阳淞 高永中,67人点评,89.60%,2018年11月,纪念改革开放四十周年 万里、曾培炎、陈锦华等改革开放重大决策亲历者真情讲述本书精选我国改革开放40年历程中具有代表性的重大决策和重大事件，通过对万里、陈锦华、谷牧、龚育之、刘鸿儒、曾培炎、徐匡迪、龙新民等约60位老领导、老同志进行访谈，以口述史的形式，展现改革开放40年中诸多重大决策出台的过程，全面回顾改革开放进程中重大事件的许多鲜为人知的细节。内容涉及审判“四人帮”台前幕后、真理标准问题讨论的前前后后、中美建交始末、邓小平南方谈话细节、独生子女政策的由来等。书中所有文章均为亲历者第一人称讲述，他们多为重大事件亲历者、决策者，并长期担任党和国家领导职位。书中既有对事实的回顾，也是亲历者心路历程的呈现，目的是真实、生动、具体地再现历史，为改革开放史研究提供第一手资料，也为广大党员、干部、群众提供生动鲜活的新时期党史读本。
古罗马帝国的辉煌,赵林,206人点评,91.40%,2023年7月,歌德曾说：“一个人如果看到了罗马，他就看到了一切。”作为古代世界中首屈一指的大帝国，罗马人曾将欧亚非的广大地区纳入疆域，罗马人开创的一系列政治制度、法律规范、管理模式以及公共工程等，至今仍影响着西方社会，成为现代西方文明永不衰竭的活水源头。 诸王传说、政体沿革、凯旋荣光、权力辉煌、英雄陨落，都将在这一部波澜壮阔的罗马帝国发展演变史中清晰呈现。让我们一起在历史、人文、哲学智慧中获得浸润，激荡心中的美德和恢宏理想，了解有温度的“永恒之城”罗马，了解当今的西方社会与世界格局。
光荣与梦想（全四册）,威廉・曼彻斯特,2324人点评,82.50%,2015年3月,王石、何怀宏、何帆、俞敏洪激荡推荐。这不是一本书，这是一个时代。自1974年问世以来，《光荣与梦想》一直为无数人念念不忘。这部伟大的作品巧妙地浓缩了美国从1932-1972年的40年丰富历史。著名通俗历史作家威廉曼彻斯特以数任美国总统的执政与竞选为明线，从让胡佛颜面尽失的“胡佛村”“胡佛车”等、罗斯福史无前例的四次当选，一路说尽杜鲁门、艾森豪威尔、肯尼迪，直至让尼克松下台的水门事件，同时不动声色地细致描画美国1932-1972年的40年社会发展历程，内容涵盖“补偿金大军”风潮、经济大萧条、人权运动、麦卡锡主义、种族隔离制度、两次世界大战、原子弹研发、空间竞赛到冷战、朝鲜战争、越南战争等。曼彻斯特将美国这40年间的政治、经济、军事、社会、艺术、科学、时尚、音乐、娱乐，甚至生活热点、妇女的服装潮流、口头语的变化、性观念的更迭全景式重现。曼彻斯特更将美国社会放在全球背景下描述，如此强烈的对比，勾起读者的强烈兴趣。
国宝来了,马菁菁,608人点评,86.80%,2020年12月,每一件国宝都饱含浓烈情感，它们只是上了些年纪，依然可爱。中国好书获奖作品《山山水水聊聊画画》系列作者、水墨艺术家马菁菁2020年全新作品，二十一件国宝，一部中国人的精神史。给大人看内行的门道，给孩子一流的人文启蒙。
韩非子（中华国学经典精粹）,韩非,828人点评,85.60%,2015年7月,《韩非子》是韩非的生平著作，是法家思想的集大成作品。是古代政治学方面的名著，与道家、儒家、墨家、阴阳家等学派的著作交相辉映。全书现存五十五篇、共计十余万字。按照内容划分，现存的文章可以划分为十组，分别从不同的角度阐发了韩非子的法家思想。本书精选了《韩非子》五十五篇中的经典篇目，按照题解、原文、注释、译文的格式对该著作进行了详细剖析，并且秉持“信、达、雅”的标准，对这部先秦时期的法家集大成之杰作进行了注解。
汉书（中华古籍国学宝典文库）,尹小林校注,62人点评,83.50%,2022年7月,《汉书》继司马迁撰写《史记》之后，班固撰写了《汉书》。新增加了《刑法志》、《五行志》、《地理志》、《艺文志》，《汉书》包括本纪十二篇，表八篇，字十篇，列传七十篇，共一百篇，后人划分为一百二十卷，它的记事始于汉高帝刘邦元年，终于王莽帝皇四年。
和|：帝王心腹,李师江,614人点评,76.50%,2023年8月,一部写透权力运行法则的和|全传！寄生于权力的人，在权力转换中瞬间覆灭！ 考场失意后和|放弃科举，进宫侍卫，虽地位低下，却能亲近天子。 苦熬三年，和|终于抓住了乾隆偶然间一句问话，以引经据典的机敏应答深获乾隆好感，得以时时陪侍皇帝左右。 此后和|平步青云，不到三十岁便位极人臣。 摸透了乾隆心思的和|又精于理财，办事能力极强，成了乾隆晚年离不开的人物，通过影响皇帝左右朝政，和|入宫不到十年便已权倾天下富可敌国。 一辈子机关算尽一路往上爬的和|，没有意识到潜藏在身边的危机也在不断积累，忘了为自己留下后路。 乾隆驾崩次日，和|就猛然踏入了万劫不复的深渊。 表面上权势熏天，实际上危如累卵。 不断玩弄权术最终被权力吞噬，一部写透权力运行法则的和|全传。 老帝王的心腹，就是新帝王的心腹大患！孤苦少年和|，只因在人群中斗胆回了一句乾隆的话，赢得龙颜大悦，顺势攀援而上，以惊人的情商和手腕，成为乾隆晚年离不开的左右手，呼风唤雨二十年，个人财产数倍于国库总收入。表面上权势熏天的和|，实际上危如累卵，不断玩弄权术最终一定会被权力吞噬！
胡适口述自传,唐德刚,270人点评,69.20%,2015年2月,《胡适口述自传》，介于自传和他传之间，是了解胡适其人其学的最好入门书。20世纪50年代，胡适应哥伦比亚大学“中国口述历史学部”之请，受唐德刚采访，以英文口述生平，于1958年完成十六次正式录音。本书即是由唐德刚根据录音，对照参考、综合译出，并于1959年经胡适手订而成。这也是唐德刚在哥伦比亚大学与胡适亲身交往、提着录音机完成的一项傲人的“口述史传工程”。在这里，胡适回顾了自己一生学术研究的历程，从投身文学革命、到审视中国哲学史，重新发现禅宗的历史，再到批判性地研究白话小说，忆及文学、史学、哲学等方面主要思想，是一本包罗了胡适学识、思想、生活、家庭背景等各方面的小书。唐德刚将胡适的英文口述译为中文后所作的注释评论，更是不可不读的好文章，一方面，胡适口述中出现的一些记忆误差、难言之隐透过唐注得到复原；另一方面，唐注又拓展和深化了口述的内容和观点，针对正文所提出的问题也阐发了自己对胡适本人及相关人物、事件的评论，使读者得以更清晰地理解胡适和他所在的时代。
胡雪岩：红顶商人胡雪岩（全集）,高阳,5650人点评,82.40%,2018年5月,讲透一代商圣胡雪岩的天才与宿命，影响中国一代企业家的经典！马云读了两遍！胡雪岩传记小说至高经典，其他版本大多是这套书的删减版或改编版。高阳版《胡雪岩全传》出版40年来无可逾越，是商人必备的生存手册。胡雪岩从店伙计到大清巨富花了30年，倾家荡产只花了9天！“有井水处有金庸，有村镇处有高阳。”武侠小说有金庸，历史小说有高阳！高阳的历史小说，注重历史的真实性，又擅长讲故事，读起来轻松畅快，有读者评为“华语历史小说不可逾越的高峰”。翻开本书，看当代历史小说巨匠高阳，重现一代商圣胡雪岩的辉煌与宿命。
华杉讲透《资治通鉴》（共22册）,华杉,506人点评,86.20%,2022年11月,《资治通鉴》从战国写到五代十国，生动展现了16个朝代1362年历史中一个个活生生的人和故事，可以说是中国政治和文化遗产的“大数据”和“超级案例集”。我们今天遇到的问题和困惑，无论是个人的还是国家的，历史先辈们都遇到过、处理过，有经验教训。本书作者华杉用“通篇大白话”翻译整部《资治通鉴》，并尽量保留原文的韵味，让人像读小说一样拿起来就放不下。同时，本书结合历代名家观点，加上华杉本人的点评，讲透《资治通鉴》中对21世纪普通人真正有用的智慧――让人看一遍就会，看完就能用得上。
环球国家地理百科全书：欧洲1,王越,142人点评,68.90%,2016年6月,1.《环球国家地理百科全书》是一套色彩艳丽、内容丰富、特色鲜明的大众地理读物。 2.全书内容是经过社科院专家和中国地理协会的老师专门审核后完成的，地理知识具有较高的权威性。3.全书共分10卷，分别从多方面介绍了世界七大洲的200多个国家与地区，资料翔实、数据全面、图片丰富。4.这套书也是目前国内图书市场上为数不多的以彩图版的形式介绍全球各国概况及风土人情的图书之一，具有极高的收藏性、阅读性和欣赏性。5.全书除了百科体知识以外，每卷后边又加了部分美文，让地理知识变得有趣而优美。6.全套采用轻型纸印刷，携带便捷，性价比很高，是自用的佳品。
环球国家地理百科全书：亚洲1,王越,267人点评,52.40%,2016年6月,1.《环球国家地理百科全书》是一套色彩艳丽、内容丰富、特色鲜明的大众地理读物。 2.全书内容是经过社科院专家和中国地理协会的老师专门审核后完成的，地理知识具有较高的权威性。3.全书共分10卷，分别从多方面介绍了世界七大洲的200多个国家与地区，资料翔实、数据全面、图片丰富。4.这套书也是目前国内图书市场上为数不多的以彩图版的形式介绍全球各国概况及风土人情的图书之一，具有极高的收藏性、阅读性和欣赏性。5.全书除了百科体知识以外，每卷后边又加了部分美文，让地理知识变得有趣而优美。6.全套采用轻型纸印刷，携带便捷，性价比很高，是自用的佳品。
活着回来的男人：一个普通日本兵的二战及战后生命史,小熊英二,725人点评,78.50%,2017年1月,第一部庶民视角的二战前后日本生活史，再现日本普通民众的生活和精神状态。书中主人公小熊谦二（作者的父亲），出生于1925年，十九岁被征兵送往中国东北，后遭苏联拘留于战俘营，在严酷的西伯利亚劳动了三年。活着返回日本后，谦二在不断更换工作时，染上当时视为绝症的肺结核。从二十五岁到三十岁，人生最失落的光景在疗养所中孤独地度过。失去半边肺叶的谦二，以三十岁“高龄”重归社会，幸而赶上日本经济高速增长的浪潮，得以从“下层的下层”爬到“下层的中层”。升为银发族后，他甚至与身在中国延边的“原朝鲜日本兵”吴雄根共同成为原告，向日本政府发起战后诉讼赔偿。作者以平实的叙事和开阔的视角记录了自己的父亲作为一个普通日本兵的生命轨迹，同时融入同时期的经济、政策、法制等状况，形成了一部“活生生的二十世纪史”。 第一个和中国人一起站上原告席状告日本政府的日本人，讲述“不被记录的多数人”的真实经历。
饥饿的盛世：乾隆时代的得与失,张宏杰,2350人点评,80.60%,2022年8月,乾隆的统治占据了18世纪的大部分时间，将康乾盛世推向巅峰。除了康熙、雍正为其打下的良好基础外，自制力强、勤政、处理问题果断迅速、善于吸收历代统治得失、感情生活比较专一、健康长寿等才是乾隆能够成功缔造盛世的重要因素。乾隆统治下的中国，纵向比，是中国几千年历史中人口最多、国力最盛的时期。横向比，是当时世界上最强大、最富庶的国家。然而，乾隆身后却是盛世的崩塌和一个逐渐衰败的大清王朝。乾隆晚年声势浩大的白莲教起义爆发；他死后不到半个世纪，鸦片战争爆发。乾隆是成功的，其成就足以让他跻身中国历史上最伟大的帝王之列；乾隆也是失败的，18世纪世界历史的发展让他的统治显得没有任何新意。从马戛尔尼使团访华事件可以看到，乾隆时期中西历史发展正经历另一种“大分流”。
艰难时代：亲历美国大萧条,斯特兹・特克尔,232人点评,62.40%,2016年12月,1929年10月24日，“黑色星期四”，美国股市暴跌。美国和全球经济从此进入了漫长的大萧条。对千百万人而言，生活成了吃、穿、住的挣扎。普遍的不安全感笼罩之下，从贫民到巨富，无人幸免。普利策奖得主斯特兹・特克尔采访了从新政官员、商业巨子到农夫、工人等各个行业、阶层的数百人，以第一手资料反映了经济大萧条怎样影响了人们的生活，当年的苦日子又是如何在今天的咀嚼下回味无穷的。特科尔的作品为美国建立起一部持续、宽广、自下而上的平民史，他本人更成为芝加哥城的标志和美国几代人的集体记忆。
简读日本史,张宏杰,931人点评,78.30%,2021年7月,张宏杰解读独特的日本历史底盘与精神世界 日本是一个特别的国家，文化内核超稳定而外表却极易变化，让世人捉摸不定。理解了日本历史的独特性与日本人的精神世界，才能理解日本对东亚、乃至世界历史走向的影响。本书从四个维度为读者呈现了一部立体而丰富的日本历史。第一部分从日本人独特的性观念切入，分析日本历史和文化的独特性；第二部分按时间顺序，简述从绳纹时代到明治维新的历史，重点是分析日本为什么进行大化改新，以及大化改新何以失败，对比日本历史轨迹与中国的相似之处；第三部分分析日本人的世界观念以及历史上的中日关系；第四部分则总结日本国民性的成因及特点。本书以多元视角与理解路径，解答关于日本的困惑，也为认识中华文明的独特性提供一个参照物。
翦商：殷周之变与华夏新生,李硕,1.2万人点评,94.60%,2022年10月,本书借助考古材料和传世文献，梳理了上古人祭风俗产生、繁荣和消亡的全过程，以及人祭与华夏早期文明从伴生到分离的伟大转折，再现了古人（周人）为终结商朝和人祭风俗付出的巨大努力，使我们对华夏文明的起源有了全新的认知。
建筑也可以很好玩：欧洲篇，从古希腊到文艺复兴,密小斯,4821人点评,91.10%,2020年3月,本书用活泼的语言、漫画的形式，结合历史故事，使读者从整体上可以快速了解整个欧洲建筑的发展历史，包括西方建筑的老祖宗为什么在古希腊，罗马角斗场是否是帝国的维稳工具，哥特式大教堂怎么就成了黑暗化身，等等。本书适合欧洲建筑爱好者、初学者阅读，也适合喜欢建筑历史文化的大众读者阅读。
津巴多口述史,菲利普・津巴多,168人点评,76.80%,2021年3月,在《津巴多口述史》中，津巴多教授首次直面读者，亲述自己一生的旅程。从他的成长故事中就足见智慧：8岁他便在和同伴的玩乐中总结出了领导者和追随者法则；读书时，他被误认为是西西里黑手党并遭到孤立，他没有因此沮丧，反而开始关注和思考情境的力量；在百老汇打工期间，他不仅积累了很多“让顾客买单”的经验，还学会了如何管理时间，迅速切换多个任务。在本书中，津巴多教授完整追溯了他50年来的教学和研究经历，述说了他的四大贡献――斯坦福监狱实验、将害羞概念化、时间观研究、英雄想象项目的前因后果和灵感来源，读者可以从中看到源于生活的、具有生命力和创造力的科学研究是如何诞生的。此外，你还会读到津巴多成为斯坦福备受欢迎的明星老师、带领上百名学生进行反战抗议、为少数族裔和女性争取就职机会等的种种经历和故事，你会发现他不仅是一位向人性发问的学者，还是一位流着教师血液的天生教育家，一位关注社会弱势群体、热爱和平的行动家，一位心怀天下的伟大思想者。从贫民区的穷小子到人人敬仰的大师，从失控的监狱实验到帮助人们成为更好的自己，《津巴多口述史》将带我们见证一代心理学大师的历练之路，同时让我们更深入地认识自我、环境与人性。
井冈山斗争口述史（全2册）,黄仲芳 罗庆宏主编,58人点评,81.00%,2015年4月,1968年至1982年，井冈山革命博物馆派出了若干采访小组，分赴全国各地，采访了140多位当年参加过井冈山斗争的老红军及相关人员。这些受访者讲述了他们井冈山斗争的亲身经历及其所见所闻。主要内容包括：关于八七会议，关于湘东赣西秋收起义，关于井冈山的斗争，关于红军被服厂、造币厂，关于王佐家世，关于红军三十二团，关于朱德，关于红五军等。采访者将这些口述作了详细的记录，共约120万字。这些记录稿以非常可信的细节，对井冈山时期诸多历史事件作了有血有肉的补充和丰富是这些重大事件的见证，具有极高的史料价值。特别是随着被采访者相继去世，这些资料更加弥足珍贵。
决战朝鲜,李峰,5955人点评,81.40%,2017年8月,全面揭开朝鲜战争台前幕后隐秘历史的必读书 畅销近30万册！戴旭、萨苏、方军倾情作序！乔良、王湘穗联袂推荐！全景式再现朝鲜战争历史命运的经典作品，全面揭开朝鲜战争台前幕后隐秘历史的必读书，入选人大附中推荐书目！附百余幅朝鲜战争珍贵历史照片！     乔良将军、王湘穗教授联袂推荐！戴旭、萨苏、方军倾情作序！被广大军迷追捧，全面揭开朝鲜战争台前幕后隐秘历史的必读书。本书是一部全景式再现朝鲜战争历史命运的经典作品，以恢宏的气势、凝练的语言、多维度的视角记述和分析了朝鲜战争成因、决策过程、五次战役及板门店停战谈判等重大事件，包括战前国际国内形势、重要战役战况、双方将帅决策过程及这场战争中涌现的堪称“军神”级人物，塑造了一大批性格鲜明的人物形象。同时，本书通过翔实的史料全面揭开朝鲜战争台前幕后的诸多历史真相，如中美苏朝最高领导层的博弈较量，朝鲜人民军南征的真相，中国出兵朝鲜真相，中美军战力真实对比，苏联对华军援、空军参战的内幕，志愿军战俘的真实境遇，板门店谈判过程等等，破除了有关朝鲜战争的种种迷思与误解，非常真实出彩。本书曾被广大军迷誉为朝鲜战争题材国内品质扛鼎的作品，畅销近30万册，本版在原有精彩内容基础上，新增了百余幅朝鲜战争历史照片，给读者以极强的代入感。
康熙大帝（全集）,二月河,1.5万人点评,88.90%,2009年9月,《康熙大帝（合集）》：记帝王人生，展宫廷百态；道清宫秘史，书宦海沉浮。作品结构紧凑，故事异彩纷呈，情节环环相扣，读之欲罢不能。
抗战老兵口述历史,刘玉,122人点评,85.70%,2017年8月,本书收录了24名抗战老兵口述当年从军的经历细节。这24名老兵中，有怒江边从死人堆中逃出的余国清，有桂林保卫战中七星岩里逃出的最后一位幸存者黄海潮，有在缅甸为远征军最高指挥官史迪威将军开过车的武彪，有参加过武汉保卫战的战地政工队女兵许良能……通过老兵们的口述，部分还原了桂柳会战、台儿庄战役、老河口大撤退、桂林保卫战以及远征军赴印缅作战的惨烈史实。
拉丁美洲被切开的血管,爱德华多・加莱亚诺,1441人点评,81.50%,2018年11月,1971年，受“依附理论”激发，乌拉圭记者、作家兼诗人爱德华多・加莱亚诺出版了这部震撼世界的《拉丁美洲被切开的血管》，试图解剖拉美的病体，探讨大陆的前途。他用难以辩驳的丰富资料，以澎湃有力的悲情笔法，铺陈出这片大陆自哥伦布开启航海新纪元之后的崎岖命运，写下一页页拉美受难史：金银、可可、棉花、橡胶、咖啡、水果、石油、铁、镍、锰、铜、锡……这些“血管”贯穿了整个拉美大陆，延伸到开阔的尽头，在那里它们流入欧洲和美国的宝库。曾经的殖民主义野蛮掠夺这片土地；而自由贸易、经济援助、合资企业、国际组织等现代文明体制同样以不文明的手段参与古老的掠夺战。拉丁美洲是一个血管被切开的地区，是拉丁美洲不发达的历史构成了世界资本主义发展的历史。本书试图揭开拉丁美洲孤独百年的真相，也让我们聆听失败者的声音：那些追求拉美独立富强的英雄和他们失败的革命。这是整个拉丁美洲悲剧的缩影。与书中所揭示的历史被官方掩盖和篡改一样，本书在出版之后不久即遭到拉美右翼政府的禁令，然而它却以几十种语言的译本走遍世界，被一代人长久地当作叛逆拉丁美洲的象征。它的论断带着时代的烙印，它的命运却已经融入历史。
李宗仁回忆录（上下册）,唐德刚,1266人点评,84.20%,2015年2月,李宗仁（1891―1969），中国近代史上一位屈指可数的政治领袖和风云人物，曾为桂系军事首领，国民党中央领导阶层的重要成员。1948年4月任国民政府第一任副总统，1949年1月在蒋介石下野后任代总统，同年12月赴美。1965年叶落归根，并于北京发表声明，决心为祖国统一作出贡献。李宗仁一生戎马，历经护国、护法、北伐、蒋桂、抗日、国共内战等战争无数，直接影响了中国现代政治与历史的走势。李宗仁寓居美国期间，应哥伦比亚大学之邀，在“东亚研究所・中国口述历史学部”襄赞下，于1958年开始亲自口述了他三十余年的戎马生涯及所参与的军国大事，由历史学者唐德刚整理撰写，遂成《李宗仁回忆录》。本书也是唐德刚个人已出版的著作中，用功最深、费力最大、遭遇困难最多的一部有原始性的史书，自动议磋商到付梓面世历时逾二十年。《李宗仁回忆录》是李宗仁不平凡的一生事业的全记录，又是李氏一生各阶段心路历程的最忠实的写照。它完整保存了李宗仁在中国历史上的真面目，并间接披露了许多鲜为人知的政治内幕或军事秘闻。对于了解和研究中国近现代史，具有至为重要参考价值。
