name,author,number,mark,publish_time,extract
历史地理学十讲,史念海,495人点评,68.70%,2020年9月,中国历史地理学巨擘、学科创建人之一史念海经典作品，历史地理学之集大成者，一书尽览祖国河山历史，北大教授辛德勇为恩师倾情作序。本书通俗易懂，妙趣横生，适合大众普及祖国历史地理知识。资料具有极高可靠性，亦可为专题研究提供准确的一手资料。史念海先生是我国现代历史地理学的创始人之一。《历史地理学十讲》汇聚了其学术成果的精粹，以十个专题分别从我国的古今气候、人口迁徙、版图规模、交通运输、城市演变、经济重心等方面厘清历史地理学中的一些基本问题。作者治学严谨，用详实的史料、严密的论证再现了我国古代历史时期地理的发展与沿革，为历史地理学的创建和发展做出重要贡献。
历史的经验,南怀瑾著述,722人点评,85.50%,2016年3月,谋略，在中国古代文化中又称之为纵横之术、长短之术、勾距之术。为总结历史的经验，南怀瑾先生就中国古代谋略做了系统讲析。上编撷取赵蕤《长短经》、刘向《战国策》、桓范《世要论》精华，参以历史上兴亡成败的实例，论述了治世、用人、防邪、辨奸之道。下编是对《素书》《太公兵法》《阴符经》的逐句串讲。
历史的棋局,国家人文历史,92人点评,77.30%,2023年1月,历史如棋谱，时代变了，那些历史的棋局还能教会我们什么？ 刘邦开国后大杀功臣？ 东汉书生、宦官、外戚到底在争什么？ 北魏实行了“子贵母死”制，为什么反而出现太后专权的情况？ 在李世民与武则天的双主角光环下，李治真的柔弱吗？ 唐代宦官权力为何这么大？  从“洪武”到“建文”，靖难之役背后的深层矛盾是什么？ ………… 历史不只是一种学问，真正的用处在于人生。 本书由国民历史读物《国家人文历史》团队编著，讲述了从商到清的政治兴衰重要节点，解读历史上的重大事件、鲜为人知的历史趣闻或者人物，呈现历史的原貌。不误导、不戏说，让历史发出真实的声音。 在历史的棋谱里，看中国人在应对时代挑战时的成败得失与经验教训，学习历史智慧。
历史的温度（套装共6册）,张玮,720人点评,84.00%,2021年12月,正在发生的事，很快会成为历史。已经成为历史的事，往往会出现在未来。蔡元培，在中国近代风云际会的舞台上，为何能一直做到言行合一？辜鸿铭，一代“狂儒”，又有过怎样的挣扎和矛盾？……总有几次，我们会站在十字路口，或面对未有之巨变，是向左还是向右，是向前还是向后？这是曾摆在辜鸿铭、蔡元培等人面前的抉择，也是当下我们时常面临的选择。面对真实世界，你怎么选择你所能相信的？是否还有潜在水面之下没显露的事实？如果你透过一些表象触及内核，你会发现，很多匪夷所思的事情之所以会发生，依然与个人的选择有关，与人性有关：贪婪、恐惧、孤独、虚荣、自私、迷茫……性格决定命运，人性决定选择。历史没有如果，不能假设，当他们站在十字路口，做出抉择时，影响的可能就是他们之后的整个人生，甚至历史。而后人读史，当感受其矛盾、纠结，去解读，去借鉴。张玮尽量用一种第三方、不带感情色彩的口吻还原当时的历史事件。在他的笔下，历史不再是冷冰冰、生人勿近的。看似由时间、地点和一连串数字组成的历史事件，背后的主角是一个个活生生的人，有血有肉、有人性、有故事、有真性情。他让原本枯燥的历史，如在眼前生动再现。
历史的温度1-5（套装共5册）,张玮,3380人点评,89.20%,2020年11月,丰富的历史知识，活色生香的历史故事 徐霞客、麦哲伦、容闳、张伯苓、刘长春、马拉、陈公博、伊藤博文……不管是这些在史书上留下了名字的人，还是那些没有留下名字的普通人，其实都有自己的信念，有自己的梦想。只是，如果把时间轴拉到足够长，大多数人的信念和梦想都随时间而湮灭了。留在史书上的那些人，有的是因为历尽艰辛，坚持的信念最终成真，而有些人所谓的“信念”本身就是个妄念，最终不光是撞了南墙，甚至还会被钉在历史的耻辱柱上。翻看历史的长卷，回顾这一个个故事，以及故事中的那些人、那些事，你会发现，人生的转折，有时真的只在一念之间，不管这些“念”，是信念还是妄念，是文念还是情念。每个历史人物或者事件，背后都曾有不为人熟知的故事，这套书的目的，就是把这些故事告诉你。在张玮抽丝剥茧般的描述中，历史被还原成了一个个有血有肉的人，这之中，有热血，有残酷，有真实，当然，也有温度。而我们作为看客，会发现，历史或许从未远去。
历史深处的民国（全集）,江城,2361人点评,90.10%,2015年10月,这是一套关于1840～1945百年正史的彪悍史书。是一套全面解读晚清、共和、抗战的长篇历史力作。从来没有一本关于民国的书籍，能像《历史深处的民国》这样，全面、真实、透彻、有趣地将民国这段历史讲明白说清楚。作者在精研民国史料的基础上，以尊重史实的严谨态度创作，以年代和具体人物为主线，用通俗易懂、幽默风趣的语言风格行笔，全新讲述了1840～1945这百年间的一些我们熟悉的人做过的一些我们并不熟悉的事……“1晚清”全景勾勒了从1840到1911前后近七十年波澜壮阔的历史，重点描述了清王朝内部改革力量曾国藩、李鸿章、袁世凯，清朝统治者慈禧、光绪，在野力量革命派、立宪派三方，围绕该挽救清朝还是推倒清朝重来而展开的一系列惊心动魄的故事。“2共和”着重描述了1911到1925年前后，以袁世凯、段祺瑞、冯国璋、张作霖、吴佩孚、冯玉祥、阎锡山为代表的北洋势力和以孙中山、黄兴、宋教仁为首的革命势力为推动中国走向何方而先合作后斗争的故事。重点关注了辛亥革命为什么可以成功、宋教仁被刺案的真相、推动清王朝倒掉的北洋势力从内斗走向灭亡以及革命派为理想中的共和国而作出的不懈努力。从不同的角度还原了不同群体在那个时代的不同政治追求与爱恨情仇，被蓄意掩盖的历史隐秘得到了充分揭示。
两京十五日（全集）,马伯庸,8265人点评,78.60%,2020年7月,马伯庸全新长篇历史小说。四个痴人、十五天、两千两百余里路的心灵之旅。千里长河，星夜奔驰，四面楚歌，命悬一线。太子这一场沿着大运河的极速奔跑，跑出了皇权与民意的博弈，跑出了宫闱与官场的心机搏杀，跑出了纠葛数十年的复杂恩怨，也跑出了从崇高到卑贱的幽微人心。这是一个小捕快、一个女医生、一个芝麻官和一个当朝太子的心灵之旅，一幅描绘明代大运河沿岸风情的鲜活画卷。
六千里运河 二十一座城,刘士林,53人点评,84.30%,2022年3月,中国大运河的历史是一部中华文明发展史，更是一部运河城市发展史。运河城市不仅对中国古代社会向更高水平发展起到重要的推动作用，也在岁月沧桑中积淀为弥足珍贵的文化资源与文明遗产。本书以运河两岸二十一座重要城市为中心，深入挖掘其历史文化资源，系统整理其文化资产和生活方式，融合地方志、文学艺术、民俗等方面的生动素材，对运河文化形态及精神价值进行了全面研究，着力阐述了其作为中华民族精神根脉的重要内涵。
论语,孔丘著 陈典译注,7391人点评,86.90%,2016年12月,古人半部《论语》治天下，今人半部《论语》修自身。尽管《论语》只是一些简单的对话，但包含了大量为人处世的大原则、大道理。国学大师南怀瑾先生曾形象地把孔子创始的儒家思想比作“粮食店”。可以说，孔子在《论语》中提出的思想，很多都是我们这个民族乃至全人类的“精神食粮”。《论语》与《大学》《中庸》《孟子》合称为“四书”，是儒家经典著作之一。《论语》首创语录之体，记录了孔子及其弟子们的言行，书中用简洁而又含义隽永的语言，讲述了修身、齐家、治国、平天下的至理名言。
马伯庸作品合集（全24册）,马伯庸,160人点评,83.40%,"4,908,589",精选畅销书作家马伯庸的17部作品，共24册，包括《两京十五日（全两册）》、《长安十二时辰（全两册）》、《古董局中局（1-4）》、《七候笔录（全两册）》、《三国机密（全两册）》、《长安的荔枝》《龙与地下铁》、《显微镜下的大明》、《风起陇西》、《草原动物园》、《三国配角演义》、《欧罗巴英雄记》、《殷商玛雅征服史》、《马伯庸笑翻中国简史》、《我读书少你可别骗我》、《事实证明，人民永远是最可爱的》、《她死在QQ上》。
梅花易数,邵雍,598人点评,91.00%,2015年9月,本书为公版书，为不受著作权法限制的作家、艺术家及其它人士发布的作品，供广大读者阅读交流。汇聚授权电子版权。
美国的故事（七册套装）,毕蓝,2754人点评,91.90%,2018年1月,让我们一起来读美国历史，读懂它的随意与平和，读懂它的苦涩和幽默。旅美华人毕蓝老师，在繁忙的工作之余，遍查资料，7年时间，笔耕不辍，足见其毅力以及对历史的热爱。一般历史书都只谈及美国二百来年的历史，本书却可追溯到1517年欧洲的宗教改革，弥补了美国建国前史料的空白，使我们全面了解到美国的前世今生。本书聚焦于美国建国前后的激情岁月。从北美殖民地的建立，到独立战争的打响，再到美国前几任总统的执政状况，作者洋洋洒洒地写了近百万字，可见她笔下的美国历史多么细致而生动。一个个历史事件，如过电影般，立体地呈现在我们面前，它们不再是枯燥的文字，而成了鲜活的故事。
门阀|“中古第一家族”琅琊王氏传承千年的成事智慧（独家首发）,南朝,1345人点评,86.40%,"154,696",首部通俗讲述“中古第一家族”琅琊王氏崛起过程的历史作品。琅琊王氏鼎盛300多年，培养了50多个宰相，类似今天市长、省长级别的高官更是不可计数，还有王羲之为代表的100多位文化名人。堪称古代最牛公务员家族。本书以电影般的叙事手法，全景讲述了琅琊王氏的崛起过程，以及他们与颍川庾氏、陈郡谢氏等豪门，以及与王室之间的百年博弈。 成大事者，慢半拍。本书总结提炼了琅琊王氏的家训、家风，发现他们在每次遇到危机的时候都有意慢人半拍。这种深藏九地之下，以静制动，后发制人的大智慧，让他们超越了同时代所有先下手为强的竞争者。 旧时王谢堂前燕，飞入寻常百姓家。这里的“王”指向一个藏在历史深处的家族：琅琊王氏。他们鼎盛300多年，在幕后操纵着一个王朝的兴衰。即使高坐御塌上的皇帝，也只是他们家族的代理人。他们被誉为“中古第一家族”。本书钩沉史料，全景式记录这个家族的崛起之路，并揭示了他们基业长青的关键所在：成大事者，慢半拍。 深藏九地之下，才能蓄积冲天之势 这个家族的奠基人是卧冰求鲤的主角王祥，一千多年来，他被打上愚孝的烙印。但我们不知道的是，孝顺的名气传出去不久，他就被邀请做官。他无意于从低阶幕僚做起，隐居深山，几十年不出。直到名气传遍天下，他才接过曹魏的橄榄枝。甫一出山，就位居九卿。 在别人狂热的时候清醒，才能看清大局 公元307年，八王之乱引发西晋内斗。当其他豪门前仆后继地卷入混战，想要分一杯羹的时候，家族第三代的代表人物王导却冷眼旁观，悄悄把目光投向了一直被忽视的江东，开拓出全新的发展基地。 避其锋锐，寻机而动，才能后发制人 公元318年，靠着王导辅佐才建立东晋的司马睿，登基伊始，就打压琅琊王氏。王导不争不怒，步步退让，直到皇帝的政策伤害到几乎所有豪门的利益时，他才暗示堂兄王敦起兵讨伐，彻底控制王室，开创了门阀时代。
孟子,孟子,1013人点评,85.70%,2017年6月,《孟子》以对话体散文的体裁，记载了孟子及其弟子的活动和言论，讲述了孟子的政治活动、政治学说以及他的哲学体系和伦理教育思想。全书行文大气磅礴，极具感染力，与《论语》《大学》《中庸》并称为“四书”，是历代儒家学子必读必考的经典著作。
棉花帝国：一部资本主义全球史,斯文・贝克特,2721人点评,79.10%,2019年3月,文津奖获奖图书，看棉花如何撼动世界 棉花产品在我们的生活中无处不在，以至于我们往往难以注意到它的重要性。但棉花产业的历史实际上是与近代资本主义的历史紧密关联在一起，理解棉花产业发展史是理解资本主义和当代世界的关键。本书作者斯文・贝克特通过叙述棉花产业发展的历史，解释了欧洲国家和资本家如何在短时间内重塑了这个世界历史上最重要的一项产业，并进而改变了整个世界面貌的。本书是名副其实的全球史，内容涉及五大洲，将非洲的贩奴贸易和红海贸易联系在了一起，将美国南北战争和印度棉花种植联系在了一起。在贝克特波澜壮阔的巨著中，商人、商业资本家、经纪人、代理人、国家官僚、工业资本家、佃农、自耕农、奴隶都有自己的角色，贝克特清楚地表明，这些人的命运是如何与近代资本主义发展联系在一起的，又是如何塑造我们现在这个存在着巨大不平等的世界的。本书告诉我们，并不存在一个所谓的“全球化”资本主义阶段，资本主义从一开始就是全球化的。
明朝那些事儿（全集）,当年明月,19.9万人点评,92.40%,2011年12月,一本书让你爱上历史。 《明朝那些事儿》主要讲述的是从1344年到1644年这三百年间关于明朝的一些故事。以史料为基础，以年代和具体人物为主线，并加入了小说的笔法，语言幽默风趣。对明朝十七帝和其他王公权贵和小人物的命运进行全景展示，尤其对官场政治、战争、帝王心术着墨最多，并加入对当时政治经济制度、人伦道德的演义。它以一种网络语言向读者娓娓道出明朝三百多年的历史故事、人物。其中原本在历史中陌生、模糊的历史人物在书中一个个变得鲜活起来。《明朝那些事儿》为我们解读历史中的另一面，让历史变成一部活生生的生活故事。
明朝那些事儿（增补版)（套装全九册),当年明月,4588人点评,91.20%,2017年5月,元末民不聊生，幼年朱元璋为生计放牛 《明朝那些事儿(增补版)(套装共9册)》包括：《明朝那些事儿（第1部）》、《明朝那些事儿（第2部）》、《明朝那些事儿（第3部）》、《明朝那些事儿（第4部）》、《明朝那些事儿（第5部）》、《明朝那些事儿（第6部）》、《明朝那些事儿（第7部）》、《明朝那些事儿（第8部）》、《明朝那些事儿（第9部）》共9册。本书主要讲述的是从1344年到1644年这三百年间关于明朝的一些事情，以史料为基础，以年代和具体人物为主线，并加入了小说的笔法，对明朝十七帝和其他王公权贵和小人物的命运进行全景展示，尤其对官场政治、战争、帝王心术着墨最多，并加入对当时政治经济制度、人伦道德的演义。
明朝那些事儿・全集（2020版）,当年明月,3956人点评,92.60%,2020年6月,《明朝那些事儿》主要讲述的是从1344年到1644年这三百年间关于明朝的历史，参考《明实录》《明通鉴》《明史》《明史纪事本末》等二十余种明代史料和笔记杂谈，经明史专家毛佩琦审订推荐，俯瞰三百年明史，看到不一样的大明王朝：明朝，一个让人血性喷薄的朝代，一个光怪陆离的朝代、一个强悍而温情的朝代，一个历经劫难又恢宏大气的朝代。明朝就像中国历史的褶皱，每翻开一篇都有精彩无比的故事蕴含着属于中国人的文化密码、政治逻辑、人性经验。
明朝那些事儿・全集（2021年 增补版）,当年明月,1360人点评,94.40%,2017年5月,本书主要讲述的是从1344年到1644年这三百年间关于明朝的历史，参考《明实录》《明通鉴》《明史》《明史纪事本末》等二十余种明代史料和笔记杂谈，经明史专家毛佩琦审订推荐，俯瞰三百年明史，看到不一样的大明王朝：大明国祚276年，历经16帝，没有一个皇帝是相似的套路；跟着朱元璋学创业、建文帝的失败启示录、嘉靖帝的权力纵横术、文艺青年明武宗、坚持一夫一妻的明孝宗、木工皇帝明熹宗；忠良义士之多，令人扼腕叹息。冷眼向敌寇，洒泪为英豪。徐达、常遇春、蓝玉，开国战神谱该怎么排，书生于谦打赢了北京保卫战、为什么王阳明会被日本人崇拜、阵法狂魔戚继光、袁崇焕是功臣还是罪人；演绎官场政治、帝王权谋。纵论江山、权术、世道、人心，朱棣背后的男人姚广孝/一代清官海瑞的多面人生/明朝头号政治家徐阶/张居正的改革触动了谁。东林党是怎样一种组织；翰墨春秋、诗画江湖、小说传奇，一个文化、经济、艺术全盛的朝代 ，《永乐大典》是如何编成的、浪荡才子唐伯虎、横空出世的明代四大奇书（《三国志通俗演义》、《水浒传》、《西游记》和《金瓶梅》）、 狂人李贽。明朝，一个让人血性喷薄的朝代，一个光怪陆离的朝代、 一个强悍而温情的朝代，一个历经劫难又恢宏大气的朝代。明朝就像中国历史的褶皱，每翻开一篇都有精彩无比的故事蕴含着属于中国人的文化密码、政治逻辑、人性经验。
明亡清兴六十年,阎崇年,185人点评,71.00%,2022年11月,本书讲述了明亡清兴六十年的历史。时间跨度从明万历十一年(1583年)努尔哈赤起兵，到清顺治元年(1644年)福临定都北京，其间整整六十年。
拿破仑大帝（全2册）,安德鲁・罗伯茨,229人点评,93.40%,2016年4月,《拿破仑大帝》是一部关于拿破仑的最新叙述体传记，安德鲁?罗伯茨基于拿破仑基金会新近编辑出版的33000封拿破仑信件等诸多材料，以拿破仑一生参与的60场战役为主线，围绕“拿破仑是摧毁者还是建设者？是解放者还是专制者？是政治家还是冒险家？”展开论述，其间驳斥了许多围绕在拿破仑身边的“黑色传奇”，认为他称得上最后的也是最伟大的开明独裁者和马背上的启蒙者，也确实当担得起“大帝”的名号。
南北战争三百年：中国4―6世纪的军事与政权,李硕,450人点评,78.00%,2018年1月,我们通常对古代战争的想象都源自演义、小说等文学作品，但这些作品中的战争场面都不过是小说家的幻想与虚构而已，并不是真实状况。《南北战争三百年》对各种史料进行分析与整理，从散落史书各处的战争叙述中寻找线索，借助全新的史学研究成果，为我们描绘出了魏晋南北朝各场重大战役细节，展现出丰富、生动的历史原貌。同时，本书对骑兵和步兵的作战模式和战术演变做了详细的论述，对战争中如地理、季节、财政等因素对战事所产生的影响进行了具体的讨论。由此，本书也补充了正史、古籍所未详述之处，通过一部军事史的写作，对魏晋南北朝历史进程做出了新的诠释。
南渡北归（经典全三册礼盒装）,岳南,7378人点评,85.20%,2015年9月,南渡北归与时下战局 【纪念西南联大成立八十周年！】莫言、杨振宁、柳传志、俞敏洪、茅于轼、张鸣、张颐武、何亮亮等人力荐！荣获《亚洲周刊》2011年度华文十大好书之冠，以及诸多大奖，好评如潮。 这是一部全景展现20世纪中国学术大师命运变迁的史诗巨著，记叙抗战年代学人的艰苦卓绝，再现国难当头大师的风骨典范。 所谓“南渡北归”，即上个世纪大批知识分子冒着抗战的炮火由中原迁往西南之地，而后再回归中原的故事。整部作品的时间跨度近一个世纪，所涉人物囊括了二十世纪人文科学领域的大部分大师级人物，如蔡元培、王国维、梁启超、梅贻琦、陈寅恪、钱锺书等。作品对这些知识分子群体命运作了细致的探查与披露，对各种因缘际会和埋藏于历史深处的人事纠葛、爱恨情仇进行了有理有据的释解，读来令人心胸豁然开朗的同时，又不胜唏嘘，扼腕浩叹。书中引用了台湾中研院大量珍贵史料、照片，以及大量亲历者采访资料，如曾氏家族后人、刘文典等大师后人亲述。
南京大屠杀,张纯如,3.6万人点评,97.40%,2013年1月,一部令国人流泪的书 1937年12月，日军攻入中国古都南京。几周之内，30多万中国平民和士兵遭到有计划地强暴、折磨和屠杀――死亡人数超过广岛和长崎原子弹爆炸遇难人数的总和。 张纯如不仅在书中详述了日军疯狂暴行的细节，而且分析了在军国主义文化背景下成长起来的日本士兵对人类生命的漠视。张纯如对南京大屠杀的幸存者进行了大量采访，并首次发掘了许多重要文献。全书先是从日本士兵、军官为什么完全脱离了人类基本的行为规范，日本学校和教科书从心理层面向学生灌输对中国人民的仇恨和蔑视，以及高度军事化的教育体制等多个方面阐述了南京大屠杀发生的根源性原因。
炮楼里的女人：山西日军性奴隶调查实录,张双兵,256人点评,75.60%,2011年5月,张双兵，1953年生于山西省盂县。1971年参加工作。1982年任乌河文学社社长，并开始调查日军侵华战争期间在山西烧杀抢掠的罪行，以及战争受害者在战前、战后的生存情况。1992年7月，组织7位受害者向日本政府提出每人10万美元的受害赔偿要求。1995年，组织5位受害者将日本政府推上了被告席。1996年7月，第一次与2位受害者走上日本法庭，控诉日本军国主义的罪行，并取得了一定进展。目前仍坚持走在为战争受害者争取日本政府赔偿的正义之路上。
品三国,易中天,5183人点评,84.90%,2018年1月,《品三国》是易中天对三国风云变幻的局势和英雄人物的分析。以故事说人物，以人物说历史，以历史说文化，以文化说人性。易中天先生纵论三国天下大事，细品英雄是非功过，总结成败得失。
启功口述历史,启功口述,92人点评,96.40%,2022年9月,本书是启功九十岁以后的口述，经启功的弟子、北京师范大学教授赵仁整理而成。在本书中，启功回顾了自己一生的经历，主要内容有启功的家族、启功的童年和求学之路、启功与辅仁大学、启功与师大和启功的学艺回顾。他的一生并没有投入到惊天动地的政治斗争的最前沿和时代旋涡的最中心，过的基本是书斋的生活。但他特殊的家庭背景、他特殊的生活经历、他在20世纪中国文化史中的特殊才能和地位，使他的书斋生活更为独特、精彩。从这里我们可以瞥见现当代很多历史的痕迹，也可以窥见当时著名文艺沙龙和著名文人的活动踪影。这些是其他人很难提供的珍贵资料。
弃长安,张明扬,3972人点评,92.90%,2022年1月,本书是一部讲述唐朝安史之乱时期历史过程与人物命运的通俗作品，以安史之乱中多位关键历史人物，即李林甫、杨国忠、安禄山、颜杲卿、哥舒翰、杨玉环、李亨、张巡等人的“弃长安”经历为线索，聚焦唐朝由盛转衰过程中的重要议题，以乱离亲历之人的经历解释“变乱何以爆发”与“盛世何以崩陷”，以此重新刻画安史之乱时期的完整历史图景。
