name,author,number,mark,publish_time,extract
柏杨白话版资治通鉴（全72册）,柏杨,1644人点评,87.00%,2020年4月,以史为鉴，知兴替，明得失。柏杨耗时十年，将《资治通鉴》译成现代语言，让一部原本只供帝王将相阅读的史书，飞入寻常百姓家。全书超过1500张地图及宫城图，让读者从图上读懂历史。柏杨查阅史书，增补历朝历代历史名家对相关事件的点评，又以现代人的观点独立撰述“柏杨曰”，使古今对话，思辨激撞，多方面、多角度解读历史事件。随文夹注历史典故、文化常识，标注今地名，帮助读者零基础读懂浩瀚巨著。中国当代文学研究会副会长、北京大学中文系主任陈晓明、中央电视台著名主持人白岩松、著名历史学家唐德刚诚意推荐。
半小时漫画大套装（套装共16册）,陈磊・半小时漫画团队,1495人点评,92.20%,2000年9月,《半小时漫画历史系列（共6册）》       看半小时漫画，通五千年历史，用漫画解读历史，开启读史新潮流！       《半小时漫画中国哲学史》       明明在看诸子百家的精彩掐架，看完却秒懂了中国哲学的奥妙精华！       《半小时漫画世界史》       简到崩溃的极简欧洲史、美国往事三部曲、一口气就能读完的日本史、肌肉猛男斯巴达300勇士、酷炫无比的加勒比海盗……       《半小时漫画唐诗宋词》系列（全4册）       看起来都是笑点，实际上全是考点，让你在哈哈大笑中重新爱上唐诗宋词。       别光笑，有考点！内含29篇初高中必考古诗文的注释+翻译，由原中考命题组组长忍住笑亲自出马撰写！       《半小时漫画经济学》系列（共4册）        用特别有趣的方式，讲清楚特别艰深的经济学原理！
半小时漫画历史系列（共7册）（中国史1-5+世界史1-2）,陈磊・半小时漫画团队,4738人点评,93.50%,2021年5月,看半小时漫画，通古今中外历史！ 其实是严谨的极简中国史+世界史。从春秋战国到宋元明清，从四大文明古国到欧洲、日本、美国……翻开本书，在笑出腹肌的同时通晓历史。《半小时漫画中国史1-5》：春秋战国像个班级；大秦过把瘾就死；楚汉之争八卦多；三国就三大战役；大唐盛世开门红；两宋繁荣特有钱；元朝皇帝换得快；大明皇大多逃不开斗外敌、斗奸臣、平内乱三件事；清朝皇帝非常努力，但挡不住世界改革的浪潮……《半小时漫画世界史1-2》：简到崩溃的极简欧洲史、美国往事三部曲、一口气就能读完的日本史。四大文明古国组团出道，为啥只剩中国屹立不倒？翻开本书，在铺天盖地的段子中，看懂另外三大文明古国的前世今生！
半小时漫画史记（全5册）,陈磊・半小时漫画团队,2788人点评,94.20%,2023年5月,半小时漫画史记大全集：1~5册。史记本来就是故事会，读起来一点都不累！ 陈磊（笔名：混子哥）领衔的半小时漫画团队通过诙谐的语言和手绘漫画的形式，鲜活生动地演绎了史记中的经典人物和故事。 司马迁写成史记，背后的故事原来这么燃！吴越之争：你若安好，那还得了！秦国：要逆袭，得坚持！如何和汉武帝愉快地做邻居？汉武帝的奇葩亲戚们都有谁？…… 读着读着你会发现，史记本来就是故事会，这样读起来一点都不累！ 翻开本书，在欢声笑语中读完史记！
半小时漫画中国地理：西藏、青海、云南、贵州,陈磊・半小时漫画团队,5711人点评,94.30%,2023年8月,从长江长城到黄山黄河，半小时尽览祖国大好河山！ 陈磊（混子哥）领衔的半小时漫画团队通过诙谐的语言和手绘漫画的形式，轻轻松松地就把中国三十四个省级行政区的地理知识讲得清清楚楚、明明白白。如果我们把全中国看成一个“班级”，那这事儿就好理解了！ 西藏是美术课代表：穿藏袍、骑牦牛、会画画。 青海是生活管理员：能送水、能拉面、能产矿。 云南是生物课代表：采菌子、养大象、种鲜花。 贵州是进步优等生：建大桥、算数据、产好茶。 翻开本书，从长江长城到黄山黄河，尽览祖国大好河山，越看越爱国！
比小说还好看的历史书（共15册）,传奇人物编辑部 张宏杰 郭宝平 王觉仁 等,179人点评,77.00%,2023年2月,套装共15册，分别为雾满拦江的人物传记《晚清民国风云人物列传 ・ 杜月笙》《晚清民国风云人物列传 ・张作霖》《晚清民国风云人物列传 ・李鸿章》、张宏杰中国史《乾隆：政治、爱情与性格》《大明王朝的七张面孔》《曾国藩的正面与侧面》《陋规：明清的腐败与反腐败》、郭宝平《最有权势的读书人：张居正》《蒋介石秘史之沉浮》《当权不过如此》《谋位》、王觉仁《历史无间道》《唐朝原来是这样》、王伟《从诸侯到帝国》《权力密码―当历史遇见经济学》
筚路维艰：中国社会主义路径的五次选择,萧冬连,4846人点评,95.70%,2014年10月,本书以简明清晰的文字对当代中国的历史轨迹作了逻辑梳理。作者认为，从执政党的建国方略、发展模式和基本政策角度考察，中国社会主义的实践路径经历了从实行新民主主义开始，途经仿效苏联模式、追寻赶超之路、发动继续革命和实行改革开放的五次历史选择。改革开放是实现中华民族复兴之梦的正途大道。
灿烂敦煌,樊锦诗 赵声良,352人点评,86.80%,2023年5月,敦煌石窟是闻名世界的佛教文化遗迹，也是古代东方艺术的宝库。季羡林先生认为，敦煌文化的灿烂，正是世界各族文化精粹的融合，也是中华文明几千年源远流长不断融会贯通的典范。著名敦煌学家樊锦诗、赵声良长年身处戈壁，在数十年研究的基础上合作撰写本书，介绍敦煌的历史与文化，解读石窟的塑像与绘画艺术，道出数代敦煌人的坚守与热诚。
曾国藩：唐浩明修订版（全集）,唐浩明,1.9万人点评,89.20%,2014年11月,晚清名臣曾国藩的风雨一生 修订老版讹误106处！一字未删，原貌呈现手稿！唐浩明独家作序认可版本！阅读收藏最佳版本！政商必读！最受中央国家机关干部欢迎的10本书之一，中纪委“读书推荐”栏目推荐学习。柳传志、宗庆后、白岩松鼎力推荐！历史小说巅峰之作，关于曾国藩最权威、最好看、最畅销的读本。了解千古名臣曾国藩的唯一经典，读懂国人处世智慧的殿堂之作。依据人民文学出版社三卷本《曾国藩》编校而成，全新修订原貌呈现。
曾国藩传（张宏杰全新增补版）,张宏杰,2.8万人点评,88.70%,2022年10月,一个持续奋斗者的升级之道。 曾国藩，没有显赫的家世，天赋堪称晚清同时代大人物当中最差，却官至两江总督、直隶总督、武英殿大学士，在复杂的时代变局中超越众人，成就最大，被誉为大清“中兴第一名臣”，且最后全身而退。他的人生经历，无论是过去还是现在都给人以特别的启示。 他出身平常，家族五六百年没出过秀才，可谓典型的小镇青年。 他智商平常，考了7次才中秀才，却以笨功夫成功打通了科举之路，顺利进入翰林院。他一生崇尚笨拙，以扎实而非机巧取胜。 他踌躇满志进京，面对全国精英，发现自己见识狭隘、观念鄙俗，陷入自卑和焦虑。三十而立，他立志学做圣人，研读经典，广交朋友，提高自我管理能力，在京期间飞速升迁。 他善于把握机会和创造机会，天下大乱之际，一介书生独创湘军，统率群雄。对抗太平天国，屡战屡败，甚至两次投江自尽，多次深陷绝境。47岁时更被皇帝弃用，陷入人生低谷。 蛰居老家两年，他反思自我，最终大悔大悟。重新出山后，为人处世脱胎换骨，不仅清除了政治敌人，而且以“结硬寨、打呆仗”战胜了军事宿敌太平天国，位极人臣。 他眼光长远，审时度势，面对与洋人的差距，率先抛弃落后观念，倡导洋务运动，师夷长技以制夷。 他走过的每一步都成为人生精进的基石，最终从笨人到圣人，成为大清王朝的最后领航者和儒家文化的最后一个偶像。 翻开本书，看曾国藩如何以一种笨拙的精神，诠释一个持续奋斗者的升级之道。
曾国藩家书,曾国藩,2541人点评,87.90%,2011年7月,清代中兴名臣曾国藩一生与家人的书信颇多，上自祖父母至父辈，中对诸弟，下及儿辈；小到家庭琐事，大到治国安邦均有所阐释。曾氏家书不仅是我们了解曾国藩、客观评价曾国藩的珍贵史料，同时他的修身、齐家、治国之理念仍为世人所推崇。阅读《曾国藩家书》，也是提高自身修养和精神境界的绝佳范本。 《曾国藩家书》收录了曾国藩一生当中具有代表性的家书123篇，按内容分为修身篇、劝学篇、治家篇、治国篇、为官篇、处世篇、养生篇。在今天看来，仍有很大的学习和借鉴价值。无论是学生还是家长，无论是在职打工人还是创业者，都能从中获得自己想要的宝藏。
成为雍正,李正,1339人点评,81.10%,2023年7月,新晋B站百大UP主【正直讲史-李正Str】动情力献！从隐忍的胤G到帝国权力巅峰，全面解读“近世中国最具代表性的独裁君主”雍正！葛剑雄、马勇、张宏杰、押沙龙联袂推荐。他是今天故宫的当家IP，他的故事，是后世无数清宫剧、穿越剧的“大学”。 勤政、多疑、冷酷、重情……似乎我们对这个复杂的雍正并不陌生，再加上层出不穷的清宫剧，也成功把这位帝王塑造成了我们身边一位熟悉的老伙计。可他到底是怎样的？那段真实的历史又是怎样的？ 本书详细阐述了雍正这位“近世中国最具代表性的独裁君主”的成长之路，以及掩盖在“康乾盛世”背影下的雍正一朝的真实面貌。全书结合了大量的史料分析，系统梳理了相关的档案文献，以独特的观察视角，再现了清帝国拐点时期的历史群像。 特别是关于雍正本人，是结合对其他历史性人物的生动描绘所塑造而出。借外部视角、借他人之言，在轮廓清晰的雍正正颜之外，带来一份我们不曾留意过的雍正侧写。而与此同时，那个上承康熙、下启乾隆的雍正王朝，就这样款款而来。
春秋大义：中国传统语境下的皇权与学术,熊逸,544人点评,77.20%,2019年3月,《春秋》在中国古代长期被尊为政治哲学的至高圣典，并被认为是唯一由孔子亲手编撰的儒家经典。但《春秋》以微言大义暗藏褒贬，是非常费解的，尤其是经过历代经学家的解读变得越来越芜杂。那么《春秋》以及相关经典是如何在两千年专制社会中发挥实际作用，甚至呼风唤雨的？一贯被当作中国精神的春秋大义，到底是怎样的一种存在？熊逸从唐朝一桩谋杀案讲起，通过大量生动的历史案例，运用翔实考据和缜密逻辑，一层层揭示了上溯至春秋时代的中国经典文化，包括《春秋》“一经三传”、《论语》《老子》等，是如何在皇权政治下被扭曲成了权力的工具的。熊逸对数千年的史实和典籍信手拈来，并让帝王、圣贤、权贵、武将、文士等不同时代的人隔空对话，他也在其中嬉笑怒骂，行文充满真知灼见，文风轻松幽默。当读者沉浸在他的文字世界时，一根绵延两千多年的线索逐渐纤毫毕现。
从唐诗走进历史,宁欣,307人点评,90.80%,2023年4月,“渭城桥头酒新熟，金鞍白马谁家宿。”从狂放不羁的五陵年少，到神鬼不惧的市井恶少，京都少年随着社会的变动，长安城的兴衰，经历了怎样的沉浮？ “文章已满行人耳，一度思卿一怆然。”白居易所写诗歌多为讽喻时弊，为何他的辞世却能引起宣宗皇帝如此的悲伤？其背后，又反映了唐朝什么样的政治和社会氛围？   ………… 以诗为媒，简读唐史；感受历史的生动，看见唐朝的二十九个侧面。著名唐史学者宁欣，以多年授课经验为基础，从唐诗入手，以通俗易懂的语言，对唐朝的官制、科举、城市风貌、文化生活、交通运输、赋役制度，乃至社会结构变迁、民族交流融合等进行了深入浅出的讲述。
大地中国（北大教授韩茂莉的历史地理通识课）,韩茂莉,66人点评,71.40%,2023年4月,《大地中国》是北京大学教授韩茂莉讲给大家的历史地理通识，历史地理爱好者人手一册的必读之书！《大地中国》全书细分为二十六个专题，以时间为纵轴、地理空间为横轴，涵盖中国历史地理的核心问题。掌握这些知识点，才能理解诸多历史大事件的节点、走向和结果，把握上下五千年中国历史的大脉络。  “中国”一词从何而来？中华文明为什么诞生于中原大地？为什么说关中地区为秦统一天下奠定了地理基础？历史上，黄河下游源何发生多次重大改道？为什么山东山西之间没有山脉相隔，却以山命名？  历史与地理密不可分，历史决定思维的深度，地理决定视野的广度。《大地中国》是北京大学教授韩茂莉写给大家的历史地理通识，二十六个专题，贯通上下五千年，遍及南北东西，涵盖了中国历史地理的重要问题，是理解中国历史大脉络的一把钥匙。
大汉帝国全史（全5册）,上医治国,934人点评,76.00%,2023年7月,天涯煮酒论史总榜第一，连载期间破天涯千万点击量，继《明朝那些事儿》之后，又一部通俗说史大书！ 一部有趣有料又严谨的汉朝历史普及读物。巍巍大汉400年，影响后世2000年！为什么汉朝能划定此后2000年间中国政治与文化的疆界？促统一！抓经济！搞开放！重民生！搞科技！文景之治、丝绸之路、造纸术、《九章算术》和《史记》，数个第一！曾用名《巍巍大汉：英雄的时代》《大汉荣耀》豆瓣评分7.9！读者评价：“语言生动有趣”“对历史小白非常友好”“通俗易懂，让我完整了解汉史”。 本书是一部汉朝历史普及读物，一共5册，分别为：1、亡秦灭楚，2、文景与汉武，3、昭宣中兴与王莽篡汉，4、东汉开国与光武中兴，5、东汉与蜀汉。从“刘邦起于草莽”讲起，一直讲到“诸葛亮辅佐蜀汉败落”为止，透过皇帝、权臣、将领、文人、后妃、外敌等超过200多个人物和发生在他们身上的上百段故事，看懂中国第一个横跨亚欧大帝国从强盛走向袁落的470年。
大明王朝1566（全集）,刘和平,3.8万人点评,91.50%,2016年7月,热剧《大明王朝1566》原著小说 豆瓣9.5分高评好剧《大明王朝1566》同名小说，台湾朝野必读，新加坡内阁政治参考书。此书为《雍正王朝》编剧、《北平无战事》作者刘和平成名之作。全书以扳倒大老虎严嵩为线索，讲述大明王朝一场盘根错节、惊心动魄的反腐大戏。揭开中国历史上最另类的皇帝嘉靖数十年不上朝的执政之谜；揭示中国历史上清官海瑞以“智忠”代“愚忠”的为官之道；揭露清修明史列为奸臣之最首辅严嵩权极而衰的真相；揭破明朝特殊的政治机构宦官集团最深层的秘密。时隔十年，该剧于2017年2月13日在优酷上线重播。
大秦帝国（套装版）,孙皓晖,1.7万人点评,89.50%,2016年10月,央视热播剧《大秦帝国》原著小说 央视热播剧《大秦赋》同题材历史小说，十几年来最具影响力的历史小说，让当代中国人为之振奋并受益的战国版“大国崛起”。全书共分《黑色裂变》《国命纵横》《金戈铁马》《阳谋春秋》《铁血文明》《帝国烽烟》六部十七册，外加一册《大秦帝国进阶指南》，将战国后期齐、楚、燕、秦、韩、赵、魏七国群雄并起的历史铺展开来，描绘了近200年的战国风云与帝国生灭。在礼崩乐坏，群雄逐鹿的战国末年，面临亡国之祸的秦国于列强环伺之下，崛起于铁血竞争的群雄列强之林。从秦孝公开始，筚路蓝缕、彻底变革、崇尚法制、统一政令，历一百六十余年六代领袖坚定不移地努力追求，才完成了一场伟大的帝国革命，扫六合而一统天下，建立起一个强大统一的帝国。这部鸿篇巨著还原了巨大的历史落差与戏剧性的帝国命运，再现了一个国家一步步实现自己梦想的悲壮历程。书中每一行每一页都充满着智慧方略、阳谋政治的风骨，奋发惕励、强势生存的精神，充满着来自中国原生文明时代的英雄风骨与本色灵魂。
大唐兴亡三百年（全集）,王觉仁,1.3万人点评,80.40%,2018年10月,读一页就上瘾的大唐三百年历史 畅销书《血腥的盛唐》全新改版！读一页就上瘾！比《唐书》有趣，比《资治通鉴》通俗，比《隋唐演义》靠谱，一部令人上瘾的300年大唐全史。知名读书节目《罗辑思维》推荐书目！了解唐朝历史，读这套就够了！《血腥的盛唐》《王阳明心学》畅销历史作家王觉仁唐史经典之作，中国断代史畅销读本！ 翻开本书，领略让你全程上瘾的300年大唐全史。
大屠杀：一部新的历史,劳伦斯・里斯,62人点评,86.40%,2020年4月,劳伦斯・里斯在二十五年的时间里采访了纳粹德国和大屠杀的幸存者和作恶者，并将亲历者的证言与新近的学术研究成果有机地整合进这段影响广泛的历史之中，揭示了这一人类历史上恶名昭著的犯罪是如何进行的。里斯认为，对犹太人的仇恨无疑是纳粹思想的核心，但如果不把纳粹也计划屠杀数百万非犹太人考虑进去，我们就不能充分理解大屠杀的本质。里斯指出，其实并不存在一个大屠杀的总体蓝图，它是一系列恐怖犯罪的不断升级。毋庸置疑，希特勒要为所发生的一切承担主要的罪责，但里斯也提醒我们，罪孽带有普遍性，而其后果也具有持续性，这也是“令人不安和闪烁其词的核心问题”。
大学・中庸（中华国学经典精粹）,曾参 子思,815人点评,87.40%,2015年7月,《大学》将人的修身作为核心基础强调齐家、治国、平天下，而治国平天下就应该以德为本。《中庸》是儒家学说的重要典籍，儒学，特别是理学，许多概念、命题出自《中庸》，《中庸》对中华文明的形成有着深远的影响。本书将《大学》《中庸》整合编撰成了一本书《大学・中庸》，里面包含了很多先圣哲人的价值反思和体验，由此也向当代读者展示了他们卓越的思想表述才能，有着很好的阅读价值和收藏价值。本书内容有四部分组成：原文、注释、译文、读解。注释简要明了，读解到位，对读者有很好的启迪作用。
大医 (全集）破晓篇+日出篇,马伯庸,1635人点评,94.10%,2023年6月,马伯庸全新长篇历史小说，分为《大医・破晓篇》《大医・日出篇》两本，本书为全集。 挽亡图存、强国保种，这是医者在清末变局中的一声呐喊。 大医若史，以济世之仁心，见证大时代的百年波澜。 一个在日俄战争中死里逃生的东北少年、一个在伦敦公使馆里跑腿的广东少年、一个不肯安享富贵的上海少女――这三个出身、性格、际遇各不相同的年轻人，在一九一年这一个关键节点，同时踏入了中国红十字会总医院，开始了他们纠葛一生的医海生涯。 《大医・破晓篇》的故事，主要集中在1904至1911年的上海、关东、皖北和英国伦敦；《大医・日出篇》的故事，是从北洋军阀时代一直延展到抗日战争乃至解放战争。通过一群卷入20世纪上半叶动乱时局的医生，通过这些医务工作者的视角和主体性介入，去充满激情地回望近代中国最苦难、最艰辛的“大历史”，书写中国人民波澜壮阔而又震撼人心的抗争史
大医・破晓篇,马伯庸,6743人点评,92.90%,2022年9月,《大医・破晓篇》是马伯庸2022年全新长篇历史小说。 挽亡图存、强国保种，这是医者在清末变局中的一声呐喊。 大医若史，以济世之仁心，见证大时代的百年波澜。
地理的故事（英文版）,（美)亨德里克・威廉・房龙,30人点评,96.20%,2016年6月,《地理的故事》撰成于1932年，几个月内在美国即销售近14万册，一年间始终居“非虚构作品”销量之最。英国版首发13万8千册，另有德文、西班牙文、意大利文、匈牙利文、葡萄牙文、瑞典文等版本面世，销量无法统计，被视为人类出版史上之“奇迹”。1933年，此书被引进中国，当年就出了三种中文译本，此后《地理的故事》又不断被重译出版，还没有哪一部地理著作，拥有如此众多的中国读者……
滴天髓,刘伯温,266人点评,85.50%,2015年9月,本书为公版书，为不受著作权法限制的作家、艺术家及其它人士发布的作品，供广大读者阅读交流。汇聚授权电子版权。
读一页就上瘾的唐朝史,范西园,465人点评,77.60%,2023年3月,大唐开国：仿佛一部热血而壮阔的战记 有人为宏图伟业做好了一切准备，却意外地中道崩殂 有人借着历史潮流腾身而起，却被后浪拍死在了沙滩上 有人在乱世的激流中退隐田园，却不甘平凡想再次叱咤风云 …… 长安城外旌旗招展的娘子军，雀鼠谷中奏响的秦王破阵乐，虎牢关前万马冲锋的玄甲铁骑，白帝城下千帆竞发的大唐舟师……都是只属于大唐的雄壮旋律！ 初唐崛起：仿佛一段明艳而血腥的悲剧 荥阳城外，黄河岸边，荥阳太守李渊在禅院潜心礼佛。后去大海寺祈愿，此后戎马倥偬，世事变迁。夺嫡之争，玄武之变，高祖退禅，无数人因此改变人生轨迹。 玄武门之变给大唐留下一个深不见底，仿佛永远也无法愈合的伤疤。它提醒着每一代帝王，权力之争是多么残酷。每一代人都不想重蹈覆辙，但每一代却都有人重复着残酷而血腥的斗争。 他们能跳出玄武门的魔咒吗？且看这唐宫的盛宴！ 盛唐兴衰：仿佛一首绚烂而壮丽的诗篇 朱雀门外的天街上千车万马，人们摩肩接踵，喜笑颜开 千家万户似围棋局般布局，夜晚灯火点亮 上元佳节的夜晚，歌舞通宵达旦，灯火烟花汇成一片星星点点的海洋 开春的花朝时节，遍目所见都是红花绿柳 盛唐之下的长安城如此美好，百姓富足、安乐，国家强盛、广袤，一切风调雨顺，蒸蒸日上，只是这个时代所有的盛景，都将在我们眼前一一毁灭、崩塌…… 唐朝后期：仿佛一曲悠远而深长的歌谣    太平盛世终不过是一座空中楼阁，安史之乱把一切美好毁灭，盛世的浮华如泡沫一般散去。兵荒马乱中，又是谁亲眼目睹了盛世的辉煌，然后在哭泣中满面尘埃地成长着？ 昭昭有唐，天俾万国。 君临天下，万邦来朝，一代又一代的君臣不停地拼搏奋斗，想要再现昔日大唐的荣光，可每当基业搭起，却又转眼消逝。帝国的挽歌让人意难平，只能空留下一声叹息。
敦煌大历史,邢耀龙,1553人点评,93.80%,2022年12月,这是一部面向普通读者的敦煌历史文化通俗读物。这是一部敦煌史，也是半部中国史；这是从石窟发出的敦煌史，也是从敦煌出发的中国史。作者沿着时间脉络，讲述各个时期敦煌相关的重要人物和故事，同时融入了最新的学术进展。  敦煌，边地如何纳入帝国版图；敦煌，文化贸易中心如何形成；敦煌，何以成为超级文旅IP；敦煌，小人物的命运如何走向，大人物的野心如何施展；敦煌，人民的生活与信仰如何延续，帝国的伟业如何惨淡经营。  敦煌，本是帝国的边缘，却以独特的方式成为世界的中心。当我们把边缘的敦煌作为锚点来回溯往事，就能赫然发现一条截然不同的历史脉络。敦煌艺术，以震撼人心的雕塑、壁画吸引五湖四海的游人；飞天、千手观音、九色鹿已成为中国文化最鲜明的名片，但当我们把这一切放在历史的进程中去，又该如何理解？敦煌学，作为20世纪以来最重要的学术潮流，早已改写了众多学科的研究进程，但是学术前沿的认知更新距离大众却相当遥远。现在，终于有一本书，可以用通俗的方式为我们讲述这一切。
