class,name,author,number,mark,publish_time,extract
文学,中国文学鉴赏辞典大系（套装共17部22册）,上海辞书出版社文学鉴赏辞典编纂中心,213人点评,97.90%,2020年9月,本套装含17部书，共22册。上海辞书出版社举全国相关领域的一流专家学者之力，历时三十余年，囊括了自先秦以迄现代的各种文学体裁名作近2万篇（首）。出版以来，深受各层次读者的欢迎，产生了持续、广泛的社会影响力，累计发行量已达上千万册，同时，其整体质量也得到了学界的高度评价，影响及于海外。2015年，入选国家新闻出版广电总局“首届向全国推荐中华优秀传统文化普及图书”。
历史,南京大屠杀,张纯如,3.6万人点评,97.40%,2013年1月,一部令国人流泪的书 1937年12月，日军攻入中国古都南京。几周之内，30多万中国平民和士兵遭到有计划地强暴、折磨和屠杀――死亡人数超过广岛和长崎原子弹爆炸遇难人数的总和。 张纯如不仅在书中详述了日军疯狂暴行的细节，而且分析了在军国主义文化背景下成长起来的日本士兵对人类生命的漠视。张纯如对南京大屠杀的幸存者进行了大量采访，并首次发掘了许多重要文献。全书先是从日本士兵、军官为什么完全脱离了人类基本的行为规范，日本学校和教科书从心理层面向学生灌输对中国人民的仇恨和蔑视，以及高度军事化的教育体制等多个方面阐述了南京大屠杀发生的根源性原因。
哲学,谈美,朱光潜,43人点评,97.00%,2020年9月,《谈美》写于1932年，是继《给青年的十二封信》之后的“第十三封信”，开明书店出版本书时，副题为《给青年的第十三封信》。《谈美》虽有《文艺心理学》的“缩写本”之称，但却并非《文艺心理学》的节略本，而是自成一体。在书中，朱光潜先生没有一丝掉书袋的气味，竟如同与一位亲密的朋友对话一般明白晓畅。作者认为“人心之怀，由于‘未能免俗’”，《谈美》的创作则只为一个目的，就是“研究如何‘免俗’”。朱自清先生为《谈美》作序时评价到：在这本书种，“孟实先生引读者由艺术走入人生，又将人生纳入艺术之中”。
文学,撒哈拉的故事,三毛,9692人点评,96.80%,2022年4月,传奇作家三毛代表作，华语文学绕不开的名作，无数人心中的华语散文“天花板”。豆瓣超42万读者9.2高分推荐，稳居豆瓣读书总榜前15！崭新修订，优选篇目，完整呈现三毛撒哈拉时期的生活与创作。一千种生活可能，一本书一网打尽！带你逃离庸常，给你“闯”的勇气，“永远在路上”永远让人着迷！无数人梦与远方的起点，无数人闪闪发光的开端！齐豫、林青霞、史航、贾平凹、饶雪漫、鲁豫、寂地、陈妍希、姚晨……各界名人都在读三毛！ 记录三毛一生中快乐的高光时刻，纪念生命中一去不返的“黄金时代”！
历史,启功口述历史,启功口述,92人点评,96.40%,2022年9月,本书是启功九十岁以后的口述，经启功的弟子、北京师范大学教授赵仁整理而成。在本书中，启功回顾了自己一生的经历，主要内容有启功的家族、启功的童年和求学之路、启功与辅仁大学、启功与师大和启功的学艺回顾。他的一生并没有投入到惊天动地的政治斗争的最前沿和时代旋涡的最中心，过的基本是书斋的生活。但他特殊的家庭背景、他特殊的生活经历、他在20世纪中国文化史中的特殊才能和地位，使他的书斋生活更为独特、精彩。从这里我们可以瞥见现当代很多历史的痕迹，也可以窥见当时著名文艺沙龙和著名文人的活动踪影。这些是其他人很难提供的珍贵资料。
文学,卡拉马佐夫兄弟（套装上下册）（陀思妥耶夫斯基文集2015）,陀思妥耶夫斯基,4083人点评,96.30%,2014年12月,本书系俄国大作家陀思妥耶夫斯基代表作之一。小说通过一桩真实的弑父案，描写老卡拉马佐夫同三个儿子即两代人之间的尖锐冲突。老卡拉马佐夫贪婪好色，独占妻子留给儿子们的遗产，并与长子德米特里为一个风流女子争风吃醋。一天黑夜，德米特里疑心自己的情人去跟老头儿幽会，便闯入家园，一怒之下，差点儿把老头儿砸死。他仓皇逃离后，躲在暗中装病的老卡拉马佐夫的私生子斯乜尔加科夫，悄然杀死老爷，造成了一桩震惊全俄的扑朔迷离的血案，从而引发了一连串惊心动魄的事件。作品展示一个错综复杂的社会家庭、道德和人性的悲剧主题，体现了作家一生的最高艺术成就。
历史,地理的故事（英文版）,（美)亨德里克・威廉・房龙,30人点评,96.20%,2016年6月,《地理的故事》撰成于1932年，几个月内在美国即销售近14万册，一年间始终居“非虚构作品”销量之最。英国版首发13万8千册，另有德文、西班牙文、意大利文、匈牙利文、葡萄牙文、瑞典文等版本面世，销量无法统计，被视为人类出版史上之“奇迹”。1933年，此书被引进中国，当年就出了三种中文译本，此后《地理的故事》又不断被重译出版，还没有哪一部地理著作，拥有如此众多的中国读者……
文学,这才是我说的,鲁迅,295人点评,96.10%,"99,477",《这才是我说的》是鲁迅先生作品的“小全集”，选取杂文、散文、小说、书信、日记、诗歌等共42篇作品，一本书看全“六边形战士”鲁迅的多面人生。  虽然鲁迅先生已经被网友们封为互联网“梗王”，但有很多梗并非鲁迅所言。《这才是我说的》一书中，每字每句包括标点符号都出自鲁迅原文。其中《从百草园到三味书屋》《社戏》《狗・猫・鼠》等我们曾被要求背诵的名篇，重读会有新的收获；《我的失恋》《我要骗人》《论“他妈的！”》体验大先生逐渐暴躁的小情绪，还有多篇从日记中精摘出来的微观探寻：鲁迅无事时日记走极简风，有事就买糖给生活加点甜；与许广平书信往来的《两地书》选篇将犀利哥的铁汉柔情暴露无遗。  在众多鲁迅作品集中，这本《这才是我说的》可能是极易见字识人并且能对作者做出全面认识的一本。享受觉醒年代的恢宏乐章里，长期被我们忽略或听而不闻的小音符，重新认识趣味、情商、审美都在线的鲁迅先生！
文学,跨山海 : 14位古代诗词偶像的真实人生,《千古风流人物》项目组,40人点评,96.00%,2022年9月,人生如逆旅，苦难如山海。在时代的洪流下，诗人与我们都是微尘。 山河难安、壮志难酬、佳偶难成、恩义难全……纵然身处坎坷、际遇多舛，他们仍能走出心灵的困境，收获旷达超脱的生命感悟，留下一篇篇绝世美文。相隔千年，他们的面容依然鲜活可敬，他们的诗词给我们留下最宝贵的礼物：当遭遇苦难、迷惘、焦虑、彷徨、不安时，它可以慰藉心灵，让我们笑看人生山海，向阳而生。
哲学,六祖坛经,慧能,869人点评,95.90%,2020年11月,《六祖坛经》，佛教经典，亦称《六祖大师法宝坛经》，简称《坛经》。禅宗六祖慧能说，其弟子法海集录。是禅宗的主要经典之一。
哲学,金刚经（典藏）,佚名,1686人点评,95.80%,2020年11月,金刚经歌者。梁朝时傅大士之所作也。武帝初请志公讲经。志公对曰。自有傅大士善解讲之。帝问。此人今在何处。志公对曰。见在鱼行。于时即照大士入内。帝问。大士欲请大士讲金刚经。要何高坐。大士对曰。不用高坐。只须一具柏板。大士得板。即唱经歌四十九颂终而便去。志公问武帝曰。识此人不。帝言不识。志公告帝曰。此是弥勒菩萨分身。下来助帝杨化。武帝忽闻情大惊讶。深加珍仰因题此颂。于荆州寺四层阁上至今现在。夫金刚经者。圣教玄关深奥难测。诸佛莫不皆由此生。虽文疏精研浩汗难究。岂若慈颂显然目前。遂使修行者不动足而登金刚宝山。谛信者寂灭识而超于涅彼岸故书。其文广博无穷。凡四十九篇烈之。于后所谓惠日流空照如来之净土禅刀入手破生死之魔军。既人法双祛俱遣快哉。斯义何以加焉。有一智者不显姓名。资杨五首以申助也。其层阁既被焚烧。恐文隋堕。聊请人贤于此阁见本请垂楷定。
历史,筚路维艰：中国社会主义路径的五次选择,萧冬连,4846人点评,95.70%,2014年10月,本书以简明清晰的文字对当代中国的历史轨迹作了逻辑梳理。作者认为，从执政党的建国方略、发展模式和基本政策角度考察，中国社会主义的实践路径经历了从实行新民主主义开始，途经仿效苏联模式、追寻赶超之路、发动继续革命和实行改革开放的五次历史选择。改革开放是实现中华民族复兴之梦的正途大道。
文学,我与地坛（插图版）,史铁生,3757人点评,95.50%,2020年3月,当代文学大家史铁生的散文质朴通透，蕴含深刻的生命哲理与丰富的人生况味，被誉为中国文坛“最美的收获”；他的诗歌充满哲思与悲悯，想象奇特语言凝炼，具有独特的文学价值。这部散文诗歌集选取了《我与地坛》《记忆与印象》《秋天的怀念》《合欢树》《黄土地情歌》等经典作品。这些以作者亲身经历为题材创作的作品，优美的行文中饱含对生命、青春、爱人、亲友、故土的爱。其中抒情散文代表作《我与地坛》如一曲深沉的生命咏叹，情感深厚，哲理含蓄，语言隽永；《记忆与印象》则如一部悲欣交集的人间戏剧，主旨深刻，京味浓郁，动人心弦；思想随笔《好运设计》执着于叩问众生命运的谜题，抽丝剥笋，娓娓道来，睿智幽默……史铁生充满神奇魅力的文字，具有穿透时光与心灵的力量，并有一种对命运的诗意把握，让我们重新思考活着的意义。
哲学,资本论（纪念版）全三卷,马克思,178人点评,95.40%,2018年3月,《资本论》是马克思理论的集大成之作，也是一部划时代的巨著。它在马克思主义理论体系中，一直居于中心的位置。可以说，《资本论》始终代表着马克思主义理论的一座“高峰”；也正是在《资本论》中，马克思的唯物主义历史观得到了系统、成熟的展现。今天，《资本论》依然是矗立在人类文明发展史上的一座里程碑，它以其恢弘的气势、缜密的逻辑、科学的论断，照耀着当前时代前进的道路。2018年是具有特殊意义的一年：党的十九大宣告我们进入了一个新时代、站在了一个新的历史方位上。同时，2018年5月5日又是马克思诞辰200周年纪念日，它标志着马克思主义这一思潮，正以习近平新时代中国特色社会主义思想这一全新的形态，继续砥砺前行，带着中华民族伟大复兴的未来图景。正是在这一新形势下，我们在系统总结以往的编译经验、全面考察以往版本的基础上，吸收理论界的宝贵建议，隆重推出《资本论》纪念版。我们相信，此纪念版不仅能充分反映马克思主义经典著作在当前时代的新成果，而且其所体现出的马克思主义立场、观点和立场，尤其是对社会矛盾的深刻把握，对于中国特色社会主义已经进入新时代这一关键时期具有重大意义。
文学,一九八四（译文经典）,乔治・奥威尔,3052人点评,95.30%,2009年6月,《一九八四》（1949）是乔治・奥威尔的传世之作，堪称世界文坛最著名的反乌托邦、反极权的政治讽喻小说。他在小说中创造的“老大哥”、“双重思想”、“新话”等词汇都已收入权威的英语词典，甚至由他的姓衍生出“奥威尔式”（Orwellian）、“奥威尔主义”（Orwellism）这样的通用词汇，不断出现在报道国际新闻的记者笔下，足见其作品在英语国家影响之深远。“多一个人看奥威尔，就多了一份自由的保障，”有论家如是说。
哲学,1844年经济学―哲学手稿,马克思,26人点评,95.00%,2021年3月,《1844年经济学―哲学手稿》是马克思的一部未完成的独立著作。它代表着马克思主义的三个基本组成部分形成过程中的一个阶段。特别是把异化问题跟政治经济学的研究结合起来，是马克思思想发展上的一次飞跃。因此，尽管《1844年经济学―哲学手稿》不是一部完整的著作，它却是马克思的很好作品之一。马克思在《1844年经济学―哲学手稿》中所阐发的思想，不仅直接为《神圣家族》和《德意志意识形态》，而且也在某种意义上为《资本论》做了理论上的准备。
历史,长安的荔枝,马伯庸,16.2万人点评,95.00%,2022年10月,同名实体书新鲜上市，马伯庸历史短小说“见微”系列神作！ 大唐天宝十四年，长安城小吏李善德突然接到一个任务：要在贵妃诞日之前，从岭南运来新鲜荔枝。荔枝保鲜期只有三天，而岭南距长安五千余里，山水迢迢，这是个不可能完成的任务。为了家人，李善德只得放手一搏…… 古装版社畜求生记，帝国夹缝中的小人物史诗。
文学,悲惨世界（全册）,雨果,2701人点评,94.80%,2015年7月,《悲惨世界》是雨果在流亡期间写的长篇小说，是他的代表作，也是世界文学宝库的珍品之一。《悲惨世界》通过冉阿让等人的悲惨遭遇以及冉阿让被卞福汝主教感化后一系列令人感动的事迹，深刻揭露和批判了19世纪法国封建专制社会的腐朽本质及其罪恶现象，对穷苦人民在封建重压下所遭受的剥削欺诈和残酷迫害表示了悲悯和同情。
哲学,西方哲学史讲演录,赵林,976人点评,94.70%,2021年12月,“哲学是活的生命。”“哲学史就是哲学。”遵循“历史与逻辑相一致”的原则，本书从古希腊哲学一直讲到黑格尔哲学，突出西方哲学思想发展的内在逻辑，通过揭示不同哲学家出现的历史顺序与哲学概念发展传承的关系，展现了哲学史就是哲学概念演变的生命历程，而不是堆积以往哲学家思想遗骸的荒冢。作为一部讲演录，本书在作者多年讲授的“西方哲学史”通识课程基础上整理而成，以通俗易懂的方式将晦涩的哲学概念娓娓道来，并省去了引经据典之繁，可谓哲学入门书首选。此次修订版特别增加“18世纪法国启蒙哲学”一讲，有助于我们更好地理解从英国经验论哲学和自然神论向德国古典哲学的过渡，弥补了初版之憾。
文学,罪与罚,陀思妥耶夫斯基,3452人点评,94.70%,2021年5月,《罪与罚》是俄国作家陀思妥耶夫斯基创作的长篇小说，也是其代表作。小说描写穷大学生拉斯柯尔尼科夫受无政府主义思想毒害，认为自己可以为所欲为。为生计所迫，他杀死放高利贷的老太婆阿辽娜和她的无辜妹妹丽扎韦达，制造了一起震惊全俄的凶杀案。经历了一场内心痛苦的忏悔后，他最终在基督徒索菲雅姑娘的规劝下，投案自首，被判流放西伯利亚。作品着重刻画主人公犯罪后的心理变化，揭示俄国下层人民的苦难生活。
历史,翦商：殷周之变与华夏新生,李硕,1.2万人点评,94.60%,2022年10月,本书借助考古材料和传世文献，梳理了上古人祭风俗产生、繁荣和消亡的全过程，以及人祭与华夏早期文明从伴生到分离的伟大转折，再现了古人（周人）为终结商朝和人祭风俗付出的巨大努力，使我们对华夏文明的起源有了全新的认知。
文学,东周列国志（全3册）,冯梦龙编 黄钧校注,187人点评,94.60%,2020年4月,本书以清蔡元放修订评点本为底本，细致校以明冯梦龙刊本，纠正讹误，注释古代地名、职官、名物、年代、典章制度以及风俗习惯，编有人物的异名、官职以及亲属关系的人名索引对照表。是《东周列国志》最为完善的读本。
历史,中国建筑史,梁思成,68人点评,94.50%,2023年2月,中国建筑是延续了两千余年的工程技术，本身已成一个系统，许多建筑物便是中国文化的具体表现，是中华民族艺术的大宗遗产。      《中国建筑史》是由SHOU位用现代科学方法研究中国古代建筑的学者梁思成先生编写，同时也是SHOU部由中国人自己编写的公正权威的中国建筑史。其按照中国历史发展顺序：上古、两汉、魏晋南北朝、隋唐、五代宋辽金、元明清、清末及民国以后，涉及了中国历史上几乎所有的建筑类型，小到阶基、勾栏、柱础、斗怼⒌袷巍⒚糯埃大到陵墓、石窟、寺观、宫殿、住宅、都市。在丰富的历史文献基础上，列举实物、分析特征，清晰地展现了各种建筑形制及其发展变化。      我们今天读中国建筑史，是为了防止犯之前削足适履、张冠李戴式的错误，是为了在未来选择、创造自己的理想生活方式。
文学,白色记事簿（天才捕手计划・口述真实故事文库）,陈拙主编,5490人点评,94.50%,2021年1月,一本白色的记事簿，记录的是催人泪下的生离死别，医患共度的艰难时刻。在医院的日常里，发现不为人知的深情，思考变幻莫测的人性，找到继续生存的勇气。全书从一线医护的视角，记录了患者是如何应对重病与生死难题；在进退维谷的两难之中，医生如何做出对患者更有利的医疗决策；在这个死神随时光顾的生死场中，医生和患者家属每天又面临着怎样的处境。这本书的创作团队是9名奋战在一线的医护工作者，他们以真诚的笔触记录了职业生涯中遇到的15位患者的真实遭遇，呈现了最真实的医院的日常，带读者了解普通人无法接触的生死场。
文学,红楼梦脂评汇校本（BookDNA典藏书系）,曹雪芹著 脂砚斋评,446人点评,94.50%,2014年8月,本书为脂砚斋评石头记的精准解读手札。《红楼梦脂评汇校本》，系以甲戌本、庚辰本等早期脂本为底本，汇集了己卯本、戚序本、蒙府本等其他脂批本的部分脂批，并参考、吸收若干新校点本及脂批辑本的校点成果整理而成。对前人意见有分歧的，略参己意而取舍，力求既不人云亦云，也不标新立异，整理成为一个方便阅读和检索的脂评红楼梦简明读本。本书具有以下特点：一、方便阅读。二、简洁明了。三、态度认真。
文学,我不是潘金莲（2022新版）,刘震云,1356人点评,94.50%,2022年8月,当代著名作家刘震云获茅奖后的第一部长篇，也是他第一部以女性为主角的小说。直逼现实，书写民苦，使这部小说成为《一句顶一万句》的姊妹篇。    和《一句顶一万句》一样，故事都是写一个戴了绿帽子的人想杀人，其实不过是想在人群中找到能说上话的人，不同的是，这本书中是一个戴绿帽子的女人，从杀人到折腾人，不过是想在人群中纠正一句话。    这个顶了潘金莲冤名的妇女经历了一场荒唐的离婚案后，要证明之前的离婚是假的，更要证明自己不是潘金莲，走上告状路。结果从镇里告到县里、市里，甚至申冤到北京的全国人民代表大会，不但没能把假的说成假的，还把法院庭长、院长、县长乃至市长一举拖下马；以至每到“两会”时她所在的省市县都要上演围追堵截的一幕，竟持续二十年。    刘震云用一个看似荒诞的故事讲述真切的生活常理。他的写作立场使他成为当代文坛少有的可以与时代、人民和国家对话的现实主义作家。
历史,明朝那些事儿・全集（2021年 增补版）,当年明月,1360人点评,94.40%,2017年5月,本书主要讲述的是从1344年到1644年这三百年间关于明朝的历史，参考《明实录》《明通鉴》《明史》《明史纪事本末》等二十余种明代史料和笔记杂谈，经明史专家毛佩琦审订推荐，俯瞰三百年明史，看到不一样的大明王朝：大明国祚276年，历经16帝，没有一个皇帝是相似的套路；跟着朱元璋学创业、建文帝的失败启示录、嘉靖帝的权力纵横术、文艺青年明武宗、坚持一夫一妻的明孝宗、木工皇帝明熹宗；忠良义士之多，令人扼腕叹息。冷眼向敌寇，洒泪为英豪。徐达、常遇春、蓝玉，开国战神谱该怎么排，书生于谦打赢了北京保卫战、为什么王阳明会被日本人崇拜、阵法狂魔戚继光、袁崇焕是功臣还是罪人；演绎官场政治、帝王权谋。纵论江山、权术、世道、人心，朱棣背后的男人姚广孝/一代清官海瑞的多面人生/明朝头号政治家徐阶/张居正的改革触动了谁。东林党是怎样一种组织；翰墨春秋、诗画江湖、小说传奇，一个文化、经济、艺术全盛的朝代 ，《永乐大典》是如何编成的、浪荡才子唐伯虎、横空出世的明代四大奇书（《三国志通俗演义》、《水浒传》、《西游记》和《金瓶梅》）、 狂人李贽。明朝，一个让人血性喷薄的朝代，一个光怪陆离的朝代、 一个强悍而温情的朝代，一个历经劫难又恢宏大气的朝代。明朝就像中国历史的褶皱，每翻开一篇都有精彩无比的故事蕴含着属于中国人的文化密码、政治逻辑、人性经验。
文学,林清玄作品集（套装共3册）,林清玄,511人点评,94.40%,2017年5月,该套装：《凡事不如看淡》《在这坚硬的世界里，修得一颗柔软心》《孤独是一个人的清欢》。《凡事不如看淡》讲的是：《凡事不如看淡》台湾知名作家林清玄老师散文精选，书中收录：《月到天心》《生平一瓣香》《柔软心》等62篇不同时期经典代表作品。凡事不如看淡，本书带领读者寻找内心清净之道。在不安的世界里，只有放下执念，抛开焦虑烦恼，才能让内心回归平和，活出人生的最好时节。《在这坚硬的世界里，修得一颗柔软心》讲的是：台湾散文大家林清玄亲自甄选的心灵美文，收录了他的经典作品《人间有味是清欢》《用欢喜心过生活》《生命的化妆》《白雪少年》等，同时也收录了《红心番薯》《咸也好，淡也好》等深受读者喜爱的作品。 看心灵大师林清玄的诗意人生，在面对这个坚硬的世界时，如他一般修得一颗柔软心。《孤独是一个人的清欢》讲的是：每个人的一生都应该读一读林清玄，才会在纷扰的世间看清真实的内心，才真正懂得如何去生活。《孤独是一个人的清欢》是林清玄2018年亲自审定的全新散文集，精选40篇经典佳作，用契合作者人生智慧的方式分为五章：以欢喜心过生活，以平常心生情味，以清净心看世界，以柔软心除挂碍，以从容心品百味。用这五颗心去生活，可以让人放下平日的浮躁与烦忧，收获内心的宁静与平和。孤独是人生的常态，孤独之前是迷茫，孤独之后是成长。而清欢是一种寻找自我的方式，亦是一种至高的人生境界。
