class,name,author,number,mark,publish_time,extract
哲学,马克思主义辩证法理论研究（马克思主义基础理论研究丛书）,孙正聿,66人点评,80.30%,2012年12月,本书立足当代辩证法研究的前沿理论，在深入发掘、分析马克思主义哲学经典文献的基础上，系统阐述了马克思主义经典作家的辩证法，如马克思的“批判本质”的辩证法、恩格斯的“理论思维”的辩证法、列宁的”三者一致”的辩证法。同时对马克思主义辩证法的理论遗产、实践基础、批判本性、当代课题等重要内容进行了全方位的探讨，凸显了马克思主义辩证法的理论魅力，对于掌握马克思主义辩证法的精髓和实质、深化马克思主义辩证法研究具有重要的理论价值。
文学,中国古代神话故事,谢桂梅,354人点评,80.20%,2019年12月,作为历史的开端，神话故事反映了一个民族最初的童年印记。本套书按照“传奇人物”“创世神话”“造物神话”“战争神话”四大体系，收录了近百篇神话故事，如“盘古开天辟地”“女娲补天”“仓颉造字”“嫘祖始蚕”“夸父逐日”“嫦娥奔月”等。这些神话故事展现了古人对天地万物的美好想象以及朴素纯真的愿望，反映了人类的伟大智慧，从中可见早期历史的光影，是古人留给我们的宝贵文化遗产。既可以启迪孩子的心智，又能教给孩子做人的道理，是中国儿童阅读的经典之作。
哲学,大众哲学,艾思奇,395人点评,80.10%,2019年4月,《大众哲学》是艾思奇20世纪30年代为通俗宣传马克思主义哲学而写的优秀著作。作者以通俗浅易的语言，生动的案例，对哲学与日常生活的关系，什么是哲学，唯心论、二元论和唯物论，辩证唯物论的认识论，唯物辩证法的基本规律及主要范畴等问题进行了全面系统的介绍阐释。写法推陈出新，开时代之风气，使哲学与日常生活相结合，贴近普通民众。本书自出版以来影响和教育了几代人，至今仍有其理论和现实的价值。
哲学,麦肯锡结构化战略思维：如何想清楚、说明白、做到位,周国元,2002人点评,80.10%,2021年1月,《麦肯锡结构化战略思维：如何想清楚、说明白、做到位》作者根据自己在麦肯锡工作的经验，首次体系化地从思考、交流到实施全流程，介绍了结构化战略思维，拆解了其方法论，着重讲了“结构化思维4大原则”“新麦肯锡5步法”和“培养结构化战略思维需要养成的10个习惯”，同时把12个知识要点用图解的方式做了直观呈现，以帮助我们学习并掌握“自上而下”的结构化战略思维方式和方法，让我们在复杂、多变、模糊而不确定的时代冲破专业与经验的禁锢，以数字和逻辑为工具，自信地面对和分解任何问题与挑战，并能快速提出高效而有创造性的解决方案，逐渐成长为解决问题的高手。
文学,另一个，同一个,豪尔赫・路易斯・博尔赫斯,1662人点评,80.10%,2016年8月,博尔赫斯创作于一九六四年的诗集，也是作者特别偏爱的一本，收诗七十五篇，包括名作《关于天赐的诗》、《猜测的诗》、《玫瑰与弥尔顿》、《胡宁》等，主题涉及布宜诺斯艾利斯、日耳曼语言文化、流逝的时间……本书开篇还附有作者序，不仅阐述了独特的诗歌美学理论，还交代了其中某些诗作受到罗伯特・勃朗宁的戏剧独白的影响，以及卢贡内斯和惠特曼的影响。
文学,中国民间故事,聂杨,1735人点评,79.90%,2019年12月,中国民间故事源远流长，从先秦到清末，经过一代又一代人口口相传，留下了不计其数的优秀故事。这些故事是中华上下五千年历史发展的沉淀，直接体现了中华民族的文化内涵，其中包括历史典故、神话传说、爱情故事、民间寓言等，内容包罗万象，囊括世间百态。阅读这些故事，领略各民族的不同文化和风土人情，从中见证中国文化的博大精深。本书精选了近六十个口碑载道的民间故事。内容浅显，道理深刻，集知识性与趣味性于一身，可激发学生的阅读兴趣，促进其心智发展，是其成长路上的好伙伴。每一则故事都承载着其独特的价值内涵，一则《铁杵磨针》，让人知道无论多么难的事，只要下定决心，持之以恒，功夫不负有心人，终会有志者事竟成；一则《三个和尚》，告诫人们自私自利只会害人害己；一则《华佗学医》，使人懂得神医也是一步一个脚印走出来的，要坚定正确的目标，坚持不懈为之努力……
哲学,周易（国学大书院）,佚名,864人点评,79.70%,2018年9月,智慧中的智慧预测学中的行为学《周易》是群经之首，是经典中之经典，哲学中之哲学，谋略中之谋略。从《周易》中，哲学家看到辩证思维，史学家看到历史兴衰，政治家看到治世方略，军事家可参悟兵法，企业家亦可从中找到经营的方法，同样，芸芸众生也可将其视为为人处世、提高修养的不二法宝。本书将《周易》的六十四卦分别予以详细解读，每卦独立自成一体，各节皆有原文、译文、启示，每卦之后附有中外著名事例，以期抛砖引玉之效。《周易》一书作为中国早熟的思想文化体系，它在中国传统思想文化中的重要地位，已为世所公认。《周易》被称为六经之首，就是一种证明。
哲学,资本论（套装共3册）,马克思,55人点评,79.70%,2013年4月,《资本论1-3(套装共3卷)》是马克思倾其毕生心血写成的一部科学著作。它被奉为工人阶级革命的“圣经”，是一部融哲学、政治经济学、科学社会主义为一体，博大精深的马克思主义百科全书，是人类思想史上不配的理论丰碑。它揭示了现代社会的经济运动规律，对于我们认识资本主义经济和研究社会主义经济提供了基本原理。
文学,海子的诗,海子,6008人点评,79.70%,2017年9月,本书精选1984到1989年间海子的短诗，包括《亚洲铜》《新娘》《黑风》《女孩子》《村庄》《阿尔的太阳》《素子和鱼》《你的手》《八月尾》《大自然》《麦地》等一百余首，这些诗歌通过寓言、纯粹的歌咏和遥想式的倾诉三种诗艺表现方式，表现出海子一生的热爱与痛惜，对于―切美好事物的着恋之情，对于生命的世俗和崇高的激动和关怀。
文学,暮色将尽,戴安娜・阿西尔,4535人点评,79.70%,2022年8月,《暮色将尽》是戴安娜・阿西尔的代表作，获得了科斯塔传记奖、美国国家图书评论奖等众多奖项，是她临近90岁高龄时写下的一本老年生活随笔，言辞坦率豁达，饶有趣味。    她由步入老年的种种变化说起，夹杂着对自己过去人生的回忆，她大方回忆自己的几段情史，坦承自己对错失母亲身份的淡然，诚实面对老年的痛楚，但也仍满怀热情地谈起在园艺、绘画、读书、写作等过程中收获到的新鲜体验。    总体而言，阿西尔为我们展现了一个非常独特的女性样本，让我们看到一个普通的知识女性，是如何在与世界的周旋中保存独立的自我，并最终坦然面对衰老与人生终点。
文学,月亮与六便士,毛姆,5436人点评,79.70%,2019年7月,银行家查尔斯，人到中年，事业有成，为了追求内心隐秘的绘画梦想，突然抛妻别子，弃家出走。他深知：人的每一种身份都是一种自我绑架，唯有失去是通向自由之途。在异国他乡，他贫病交加，对梦想却愈发坚定执着。他说：我必须画画，就像溺水的人必须挣扎。在经历种种离奇遭遇后，他来到南太平洋的一座孤岛，同当地一位姑娘结婚生子，成功创作出一系列惊世杰作……
文学,世说新语（全集）,刘义庆,691人点评,79.60%,2019年11月,《世说新语》由南朝宋临川王刘义庆组织门下文人编撰而成，是我国最早的一部记述魏晋人物言谈逸事的笔记体小说。全书共36篇1000多则，反映了魏晋时代尤其是当时名士的风貌。自诞生以来，即以风流放诞、率真超脱的“魏晋风度”，深刻影响了中国文人及文化史，从而成为中国人不可不读的一部经典。本版《世说新语》是由超人气作家小岩井倾心翻译，除译文外，另撰写1700余条注释和500余条简评，帮助我们探索经典古籍的魅力。
文学,长寿的代价：我和六位老人共处的一年,约翰・利兰,442人点评,79.50%,2020年9月,“在那一年，我问他们每个人，是否想过死亡，想到这个是否会感到害怕。几乎所有人都对第二个问题做出了否定的回答。活得太久让他们害怕；而死亡可以解决活得太久的问题。他们晚年的智慧之一是承认死亡和变老是生活的一部分。只有年轻人认为自己不会死，或者变老是发生在别人身上的事。” ――约翰・利兰 如果活得足够长，每个人都会有成为老人的一天。21世纪已经进入长寿时代，我们也随之步入老龄化社会，那么变老对我们来说意味着什么？我们要为长寿付出什么样的代价？ 资深《纽约时报》记者约翰・利兰刚刚结束婚姻，父亲早已去世，现在他要独自照顾年迈的母亲。他逐渐发现一些独属于老人以及与老人相处的问题，于是他带着一系列疑问追踪并贴身采访六位高龄纽约老人，时间持续整整一年。 在采访的那一年，他57岁，而他的受访者都超过 85 岁，这也是美国增长迅速的年龄层。所有老人都失去了点什么：行动能力、视力、听力、配偶、子女、同伴、记忆。从起床的那一刻直到就寝，他们是怎样度过一天的，他们对明天有什么期望？他们怎样应对服药问题、子女和不断变化的身体状态？他们丧失能力的速度像昔日获得能力一样快。有没有这样一道门槛，跨过去之后，人生的价值就逐一丢失？ 约翰选取了大多数人不愿意谈论和面对的主题――老人是如何慢慢衰老并走向死亡的。即使国家的养老制度已经很完善，依然有很多老人无法“善终”。这六位老人都不能再说“明天会更好”。明天对他们来说意味着思维和身体进一步衰退，对生活的掌控更弱，朋友和爱人更少。无论他们有什么健康问题――糖尿病、健忘、心脏病、老眼昏花或者听力不佳，都只会不断恶化。 在书中，约翰以记者的生动笔触，如实记录了老人的生存现状，关注议题涉及老人的健康，老后的艰难，老年人的孤独感，独居的困境，养老的保障，养老院的体系设置，医疗的局限，生前遗嘱的意义，与配偶子女的情感与矛盾，以及如何过上自主、快乐、有尊严的老龄生活。 在老龄化和少子化日渐严重的今天，这本书对我们来说有极为重要的价值与参考意义。
文学,黄金时代,王小波,3.8万人点评,79.40%,2015年8月,王小波代表作 一代人的精神标识 《黄金时代》包括中篇小说《黄金时代》、《三十而立》、《似水流年》、《革命时期的爱情》和《我的阴阳两界》等。
哲学,批判性思维（原书第12版）,布鲁克・诺埃尔・摩尔 理查德・帕克,361人点评,79.30%,2020年9月,本书第12版问世了，我们依然不忘初心：帮助训练学生的批判性思维、做出更好的决策，也让从事批判性思维教学的老师更得心应手地使用本书。为更好地实现我们的初愿，欢迎师生们联系我们，提出你们的宝贵意见。一如既往，新版更新了例子，其中的人物和事件都是学生更熟知的。正如我们之前提到过的，对老师而言新近发生的事件，对于刚入校的大学生来说可能已然是模糊的历史。本书的其他变动分述如下。章节具体变化：第1章全面介绍了我们的批判性思维观，较之前更深入地探讨了影响思维的认知偏见。第2章中修改了一节：最佳解释推理。第3章较为精简，但对模糊与抽象有充分探讨，对定义的种类也有更新阐述。第4章有例行修订并增加了一部分内容：来自社交媒体的新闻。第5章更新了图片，在“暗示”一节中增添了“意味深长地提及”这个子话题。第6章改动较小，主要更新了例子和图片。第7章变化不大，主要用学生更明了的语言表达各“诉诸”谬误。第8章相对于之前的版本来说是全新的，新版将“假阳性”替换为更易理解的“错误的归纳换位”。第9章更新为浅显易懂的例子，单独论述了“存在假设”，使人们更难忽略它。第10章最值一提的变动是重新纳入了真值函数论证模式（简版），以便满足不同的教学需求。第11章对概括和类比的顺序做了微调，有关因果假说的分析保持不变。第12章主要修改了一些例子。
哲学,在绝望之巅,E.M.齐奥朗,1176人点评,79.30%,2022年5月,“二十世纪的尼采”、现代欧洲伟大的哲学家E.M.齐奥朗的代表作！苏珊・桑塔格、伊塔洛・卡尔维诺、米兰・昆德拉、保罗・策兰、萨缪尔・贝克特等诸多当代名家一致推崇。其作品以断章体的形式和对痛苦磨难、虚无主义等问题的思考而著称，在国际上享有盛誉。 《在绝望之巅》是二十世纪著名哲学家E.M.齐奥朗的初试啼声之作，写于作者饱受抑郁症和失眠症困扰时期。齐奥朗在其中对种种形而上学问题提出了自己的独特见解，主题涉及荒谬、异化、抑郁、失眠、爱情、狂喜、苦难、贫穷、善恶等。本书以一种新奇的、抒情的、反体系化的哲学风格，奠定了齐奥朗的创作基调，作为这位现代哲学家的思想源泉，意义重大。 《在绝望之巅》既是齐奥朗重要的代表作，也是他非常受欢迎的作品，精致的散文语言、断章体的创作形式和悲观的哲学思想有机结合，表现出荒诞主义和后现代主义态度，对西方知识界产生了极大影响。
文学,仲夏夜之梦,莎士比亚,1168人点评,79.30%,2019年2月,《仲夏夜之梦》是莎士比亚创作的一部喜剧，讲述了在魔力花汁的影响下，产生的一系列戏剧冲突，到冲突被解决，有情人终成眷属的爱情故事。此剧在世界文学史特别是戏剧史上影响巨大。1590年到1613年是莎士比亚的创作的黄金时代。他的早期剧本主要是喜剧和历史剧，在16世纪末期达到了深度和艺术性的高峰。到1608年，他主要创作悲剧，莎士比亚崇尚高尚情操，他的悲剧常常描写牺牲与复仇，包括《奥瑟罗》、《哈姆莱特》、《李尔王》和《麦克白》，被认为属于英语最佳范例。在他人生最后阶段，他开始创作悲喜剧，又称为传奇剧。
历史,改革开放口述史,欧阳淞 高永中,24人点评,79.20%,2014年1月,本书选择三十多年改革开放历程中的重大决策和重大事件，系统梳理、精心选编，以口述史的形式，让亲身经历和见证改革开放历史的老领导、老同志追忆细节，让见证者感悟得失，让思想者升华经验，目的是真实、生动、具体地再现历史，为改革开放史研究提供第一手资料，也为广大党员、干部、群众提供生动鲜活的新时期党史读本。本书由中央党史研究室主任欧阳淞作序，收录了万里、陈锦华、谷牧、龚育之、刘鸿儒、曾培炎、徐匡迪、龙新民等50余老领导、老同志的回忆录、口述历史，是研究这段历史的重要资料和宝贵财富。
文学,枕上诗书：一本书读懂最美古诗词,徐若央,859人点评,79.20%,2019年5月,品读古典诗词中的浪漫与哀愁，读一首诗，讲一段故事。 全书从每小节的引子，到文中引申，涵盖中国古代经典诗词歌赋近百首。 每个诗词歌赋，引出一段发人深思的故事，每个故事的背后，隐藏着更多的诗词歌赋…… 书名取李清照的词：“枕上诗书闲处好，门前风景雨来佳。”全书汇集从先秦到大清，各大家、各种类经典诗词歌赋，由作者解析创作而成。 书中有闲情，有深意，有情怀，也有故事，读来轻松愉悦。
哲学,好的爱情：陈果的爱情哲学课,陈果,1.2万人点评,79.10%,2018年5月,我们可以一秒爱上，但却不懂如何用一生去爱 长久的爱情，就是一次又一次地爱上同一个人。复旦名师陈果，用哲学的方式告诉你，怎样的爱情才更长久！每个人都向往爱情，但是却少有人懂得如何真正去爱。很多情侣看起来明明很相爱，但最后却还是要分开。这就是因为，我们可以用一秒钟爱上一个人，但却不懂得如何用一生去爱TA。好的爱情，不是互相占有，而是共同成长。当我们用心感受爱，培育爱，我们就能在精神上一路同行。当我们每天都变得更好一点，并用心发现对方的改变，我们就能参与对方生命的成长，一次又一次地爱上同一个人。这就是令爱情长久的秘密，千变万化，又始终如一。翻开本书，感受爱情的艺术，爱情的学问，让爱永远不会被时间所打败。
历史,棉花帝国：一部资本主义全球史,斯文・贝克特,2721人点评,79.10%,2019年3月,文津奖获奖图书，看棉花如何撼动世界 棉花产品在我们的生活中无处不在，以至于我们往往难以注意到它的重要性。但棉花产业的历史实际上是与近代资本主义的历史紧密关联在一起，理解棉花产业发展史是理解资本主义和当代世界的关键。本书作者斯文・贝克特通过叙述棉花产业发展的历史，解释了欧洲国家和资本家如何在短时间内重塑了这个世界历史上最重要的一项产业，并进而改变了整个世界面貌的。本书是名副其实的全球史，内容涉及五大洲，将非洲的贩奴贸易和红海贸易联系在了一起，将美国南北战争和印度棉花种植联系在了一起。在贝克特波澜壮阔的巨著中，商人、商业资本家、经纪人、代理人、国家官僚、工业资本家、佃农、自耕农、奴隶都有自己的角色，贝克特清楚地表明，这些人的命运是如何与近代资本主义发展联系在一起的，又是如何塑造我们现在这个存在着巨大不平等的世界的。本书告诉我们，并不存在一个所谓的“全球化”资本主义阶段，资本主义从一开始就是全球化的。
历史,一读就上瘾的中国史,温伯陵,5973人点评,79.10%,2020年9月,一个杨贵妃，在李白眼里是“云想衣裳花想容，春风拂槛露华浓”；在杜牧眼里是“一骑红尘妃子笑，无人知是荔枝来”；而在罗隐眼里，则是“泉下阿蛮应有语，这回休更怨杨妃”。美女、宠妃、败家娘们儿以及背锅女侠，哪一个才是真的杨贵妃？一座长安城，在汉唐，是无可取代的帝国中枢，是王维笔下的“万国衣冠拜冕旒”；在宋朝，却成了边境军镇；而在明朝末年，又沦为饥荒遍地、易子而食的人间地狱。温伯陵的文章，既有细节故事，又有历史大局观，惊险刺激，一读就上瘾。在温伯陵笔下，历史不再是按时间码放的记事簿，而是贯通时间、看清脉络的时代演变过程。用他的方法来读历史，你将发现历史背后的那只手，彻底看懂历史的过去、现在和未来。
历史,两京十五日（全集）,马伯庸,8265人点评,78.60%,2020年7月,马伯庸全新长篇历史小说。四个痴人、十五天、两千两百余里路的心灵之旅。千里长河，星夜奔驰，四面楚歌，命悬一线。太子这一场沿着大运河的极速奔跑，跑出了皇权与民意的博弈，跑出了宫闱与官场的心机搏杀，跑出了纠葛数十年的复杂恩怨，也跑出了从崇高到卑贱的幽微人心。这是一个小捕快、一个女医生、一个芝麻官和一个当朝太子的心灵之旅，一幅描绘明代大运河沿岸风情的鲜活画卷。
历史,活着回来的男人：一个普通日本兵的二战及战后生命史,小熊英二,725人点评,78.50%,2017年1月,第一部庶民视角的二战前后日本生活史，再现日本普通民众的生活和精神状态。书中主人公小熊谦二（作者的父亲），出生于1925年，十九岁被征兵送往中国东北，后遭苏联拘留于战俘营，在严酷的西伯利亚劳动了三年。活着返回日本后，谦二在不断更换工作时，染上当时视为绝症的肺结核。从二十五岁到三十岁，人生最失落的光景在疗养所中孤独地度过。失去半边肺叶的谦二，以三十岁“高龄”重归社会，幸而赶上日本经济高速增长的浪潮，得以从“下层的下层”爬到“下层的中层”。升为银发族后，他甚至与身在中国延边的“原朝鲜日本兵”吴雄根共同成为原告，向日本政府发起战后诉讼赔偿。作者以平实的叙事和开阔的视角记录了自己的父亲作为一个普通日本兵的生命轨迹，同时融入同时期的经济、政策、法制等状况，形成了一部“活生生的二十世纪史”。 第一个和中国人一起站上原告席状告日本政府的日本人，讲述“不被记录的多数人”的真实经历。
文学,白先勇细说红楼梦（全集）,白先勇,7863人点评,78.40%,2017年2月,当八十岁的白先勇，遇见三百岁的曹雪芹，听华文世界小说大家如何解“天下第一书”，看两个时代文学赤子跨越时空的心灵相印。本书由白先勇台湾大学《红楼梦》导读通识课（2014-2015）课堂讲义编纂而成。《红楼梦》是一本天书，有解说不尽的玄机、探索不完的秘密，但最重要的，它终究是一部伟大的小说。白先勇正本清源，把这部文学经典完全当作小说来导读，侧重解析《红楼梦》小说艺术的“现代性”：神话构架、人物塑造、文字风格、叙事手法、观点运用、对话技巧、象征隐喻、平行对比、千里伏笔，检视曹雪芹如何将各种构成小说的元素发挥到极致，并远远超越它的时代，甚至比西方现代主义文学更早、更前卫。他以小说家的艺术敏感，擦去经典的蒙尘之处，将历来被冷落的人物、被曲解的角色一一归还原本的个性姿彩，令其登台绽放。在文字艺术的赏读玩味之间，解读中国人生哲学的绝妙真意与人情社会的文化密码，更从一本伟大的小说延展开去，漫谈文学、美学、哲学、昆曲的枝枝蔓蔓，织构一座如梦如幻的红楼琼宇。白先勇借此细读机缘，仔细比对“庚辰本”与“程乙本”的差别，掂量一字一句的千斤之重与微妙意蕴，得以重新发现失落已久的“程乙本”《红楼梦》之美。
哲学,知行合一王阳明,度阴山,1.4万人点评,78.30%,2014年7月,王阳明新婚之夜失踪，和高人切磋养生大法 在蛮荒的龙场，王阳明悟出了“圣人之道，吾性自足”，即人人皆有良知。而在血腥的沙场和险恶的朝堂，让龙场悟道实际发挥作用的，是“知行合一”，即遵循内心的良知，便能达到宁静于内、无敌于外的境界。如果心学是圣贤功夫，那么知行合一则是俗世智慧。知行合一并非得自顿悟，而是在磨难中不断反思、修练，最终砥砺出的生命境界。在经历了当众廷杖的奇耻、下狱待死的恐惧；流放南蛮的绝望、瘟疫肆虐的危险；荒山野岭的孤寂、无人问津的落寞，直至悟道的狂喜、得道的平静后，王阳明不但求得了内心的安宁，而且逐渐通过“知行合一”拥有了足以改变世界的力量。
历史,简读日本史,张宏杰,931人点评,78.30%,2021年7月,张宏杰解读独特的日本历史底盘与精神世界 日本是一个特别的国家，文化内核超稳定而外表却极易变化，让世人捉摸不定。理解了日本历史的独特性与日本人的精神世界，才能理解日本对东亚、乃至世界历史走向的影响。本书从四个维度为读者呈现了一部立体而丰富的日本历史。第一部分从日本人独特的性观念切入，分析日本历史和文化的独特性；第二部分按时间顺序，简述从绳纹时代到明治维新的历史，重点是分析日本为什么进行大化改新，以及大化改新何以失败，对比日本历史轨迹与中国的相似之处；第三部分分析日本人的世界观念以及历史上的中日关系；第四部分则总结日本国民性的成因及特点。本书以多元视角与理解路径，解答关于日本的困惑，也为认识中华文明的独特性提供一个参照物。
